STT,Mã CK▲,Tên công ty,Ngành,Sàn,Khối lượng NY/ĐKGD
1,A32,CTCP 32,Hàng tiêu dùng và trang trí,UPCoM,6800000
2,AAA,CTCP Nhựa An Phát Xanh,Nguyên vật liệu,HOSE,382274496
3,AAH,CTCP Hợp Nhất,Năng lượng,UPCoM,117900000
4,AAM,CTCP Thủy sản MeKong,"Thực phẩm, đồ uống và thuốc lá",HOSE,12346411
5,AAS,CTCP Chứng khoán SmartInvest,Dịch vụ tài chính,UPCoM,229999521
6,AAT,CTCP Tập Đoàn Tiên Sơn Thanh Hóa,Hàng tiêu dùng và trang trí,HOSE,70819103
7,AAV,CTCP AAV Group,Phát triển và quản lý bất động sản,HNX,68987661
8,ABB,Ngân hàng TMCP An Bình,Tổ chức tín dụng,UPCoM,1035036762
9,ABC,CTCP Truyền thông VMG,Dịch vụ viễn thông,UPCoM,20393000
10,ABI,CTCP Bảo hiểm Ngân hàng Nông nghiệp Việt Nam,Bảo hiểm,UPCoM,72391750
11,ABR,CTCP Đầu tư Nhãn hiệu Việt,Dịch vụ viễn thông,HOSE,20000000
12,ABS,CTCP Dịch vụ Nông nghiệp Bình Thuận,Nguyên vật liệu,HOSE,80000000
13,ABT,CTCP Xuất nhập khẩu Thủy sản Bến Tre,"Thực phẩm, đồ uống và thuốc lá",HOSE,14387207
14,ABW,CTCP Chứng khoán An Bình,Dịch vụ tài chính,UPCoM,101150000
15,ACB,Ngân hàng TMCP Á Châu,Tổ chức tín dụng,HOSE,4466657912
16,ACC,CTCP Đầu tư và Xây dựng Bình Dương ACC,Tư liệu sản xuất,HOSE,104999993
17,ACE,CTCP Bê tông Ly tâm An Giang,Nguyên vật liệu,UPCoM,3050781
18,ACG,CTCP Gỗ An Cường,Nguyên vật liệu,HOSE,150787946
19,ACL,CTCP Xuất nhập khẩu Thủy sản Cửu Long An Giang,"Thực phẩm, đồ uống và thuốc lá",HOSE,50159019
20,ACM,CTCP Tập đoàn Khoáng sản Á Cường,Nguyên vật liệu,UPCoM,51000000
21,ACS,CTCP Xây lắp Thương mại 2,Tư liệu sản xuất,UPCoM,4000000
22,ACV,Tổng Công ty Cảng Hàng không Việt Nam - CTCP,Vận tải,UPCoM,2177173236
23,ADC,CTCP Mỹ thuật và Truyền thông,Truyền thông và giải trí,HNX,3977936
24,ADG,CTCP Clever Group,Truyền thông và giải trí,HOSE,21380521
25,ADP,CTCP Sơn Á Đông,Nguyên vật liệu,HOSE,23039850
26,ADS,CTCP Damsan,Hàng tiêu dùng và trang trí,HOSE,76394727
27,AFX,CTCP Xuất nhập khẩu Nông sản Thực phẩm An Giang,"Thực phẩm, đồ uống và thuốc lá",UPCoM,35000000
28,AG1,CTCP 28.1,Hàng tiêu dùng và trang trí,UPCoM,4863386
29,AGF,CTCP Xuất nhập khẩu Thủy sản An Giang,"Thực phẩm, đồ uống và thuốc lá",UPCoM,28109743
30,AGG,CTCP Đầu tư và Phát triển Bất động sản An Gia,Phát triển và quản lý bất động sản,HOSE,162528081
31,AGM,CTCP Xuất Nhập khẩu An Giang,"Thực phẩm, đồ uống và thuốc lá",HOSE,18200000
32,AGP,CTCP Dược phẩm Agimexpharm,"Dược phẩm, Công nghệ sinh học và Khoa học thường thức",UPCoM,23143941
33,AGR,CTCP Chứng khoán Agribank,Dịch vụ tài chính,HOSE,215391309
34,AGX,CTCP Thực phẩm Nông Sản xuất khẩu Sài Gòn,"Thực phẩm, đồ uống và thuốc lá",UPCoM,10800000
35,AIC,Tổng Công ty Cổ phần Bảo hiểm DBV,Bảo hiểm,UPCoM,100000000
36,AIG,CTCP Nguyên liệu Á Châu AIG,Bán lẻ thực phẩm và nhu yếu phẩm,UPCoM,170601298
37,ALT,CTCP Văn hóa Tân Bình,Nguyên vật liệu,HNX,6172523
38,ALV,CTCP Xây dựng ALVICO,Tư liệu sản xuất,UPCoM,5657936
39,AMC,CTCP Khoáng sản Á Châu,Nguyên vật liệu,HNX,2850000
40,AMD,CTCP Đầu tư và Khoáng sản FLC Stone,Tư liệu sản xuất,UPCoM,163504874
41,AME,CTCP Alphanam E&C,Tư liệu sản xuất,HNX,65200000
42,AMP,CTCP Armephaco,Phân phối và bán lẻ hàng lâu bền,UPCoM,13000000
43,AMS,CTCP Cơ khí Xây dựng AMECC,Tư liệu sản xuất,UPCoM,60000000
44,AMV,CTCP Sản xuất Kinh doanh Dược và Trang thiết bị Y tế Việt Mỹ,Dịch vụ và thiết bị chăm sóc sức khỏe,HNX,131105650
45,ANT,CTCP Rau quả Thực phẩm An Giang,"Thực phẩm, đồ uống và thuốc lá",UPCoM,18399823
46,ANV,CTCP Nam Việt,"Thực phẩm, đồ uống và thuốc lá",HOSE,266667500
47,APC,CTCP Chiếu xạ An Phú,Dịch vụ chuyên biệt và thương mại,UPCoM,20121395
48,APF,CTCP Nông sản Thực phẩm Quảng Ngãi,"Thực phẩm, đồ uống và thuốc lá",UPCoM,29770578
49,APG,CTCP Chứng khoán APG,Dịch vụ tài chính,HOSE,223621942
50,APH,CTCP Tập đoàn An Phát Holdings,Nguyên vật liệu,HOSE,243884268
51,API,CTCP Đầu tư Châu Á - Thái Bình Dương,Phát triển và quản lý bất động sản,HNX,84083976
52,APL,CTCP Cơ khí và Thiết bị áp lực - VVMI,Phân phối và bán lẻ hàng lâu bền,UPCoM,1200000
53,APP,CTCP Phát triển Phụ gia và Sản phẩm Dầu Mỏ,Năng lượng,UPCoM,4724632
54,APS,CTCP Chứng khoán Châu Á Thái Bình Dương,Dịch vụ tài chính,HNX,83000000
55,APT,CTCP Kinh doanh Thủy Hải Sản Sài Gòn,"Thực phẩm, đồ uống và thuốc lá",UPCoM,8800000
56,ARM,CTCP Xuất nhập khẩu Hàng không,Vận tải,HNX,3111283
57,ART,CTCP Chứng khoán BOS,Dịch vụ tài chính,UPCoM,96922509
58,ASA,CTCP ASA,Tư liệu sản xuất,UPCoM,10000000
59,ASG,CTCP Tập đoàn ASG,Vận tải,HOSE,90784669
60,ASM,CTCP Tập đoàn Sao Mai,"Thực phẩm, đồ uống và thuốc lá",HOSE,370178250
61,ASP,CTCP Tập đoàn Dầu khí An Pha,Năng lượng,HOSE,37339929
62,AST,CTCP Dịch vụ Hàng không Taseco,Vận tải,HOSE,45000000
63,ATA,CTCP Ntaco,"Thực phẩm, đồ uống và thuốc lá",UPCoM,11999998
64,ATB,CTCP An Thịnh,Tư liệu sản xuất,UPCoM,13884000
65,ATG,CTCP An Trường An,Nguyên vật liệu,UPCoM,15220000
66,ATS,CTCP Tập đoàn Đầu tư ATS,Dịch vụ tiêu dùng,HNX,3500000
67,AVC,CTCP Thủy điện A Vương,Dịch vụ tiện ích,UPCoM,75052052
68,AVF,CTCP Việt An,"Thực phẩm, đồ uống và thuốc lá",UPCoM,43338000
69,AVG,CTCP Phân bón Quốc tế Âu Việt,Nguyên vật liệu,UPCoM,17679982
70,BAB,Ngân hàng TMCP Bắc Á,Tổ chức tín dụng,HNX,958021843
71,BAF,CTCP Nông nghiệp BAF Việt Nam,"Thực phẩm, đồ uống và thuốc lá",HOSE,239021642
72,BAL,CTCP Bao bì Bia - Rượu - Nước giải khát,Nguyên vật liệu,UPCoM,2000000
73,BAX,CTCP Thống Nhất,Phát triển và quản lý bất động sản,HNX,8200000
74,BBC,CTCP Bibica,"Thực phẩm, đồ uống và thuốc lá",HOSE,18752687
75,BBH,CTCP Bao bì Hoàng Thạch,Nguyên vật liệu,UPCoM,2047932
76,BBM,CTCP Bia Hà Nội - Nam Định,"Thực phẩm, đồ uống và thuốc lá",UPCoM,2000000
77,BBS,CTCP VICEM Bao bì Bút Sơn,Nguyên vật liệu,HNX,6000000
78,BBT,CTCP Bông Bạch Tuyết,Dịch vụ và thiết bị chăm sóc sức khỏe,UPCoM,9800000
79,BCA,CTCP B.C.H,Nguyên vật liệu,UPCoM,19000000
80,BCB,CTCP 397,Năng lượng,UPCoM,5700000
81,BCC,CTCP Xi măng Bỉm Sơn,Nguyên vật liệu,HNX,123209812
82,BCE,CTCP Xây dựng và Giao thông Bình Dương,Hàng tiêu dùng và trang trí,HOSE,35000000
83,BCF,CTCP Thực phẩm Bích Chi,"Thực phẩm, đồ uống và thuốc lá",HNX,33897213
84,BCG,CTCP Tập đoàn Bamboo Capital,Tư liệu sản xuất,HOSE,880210644
85,BCM,Tổng Công ty Đầu tư và Phát triển Công nghiệp – CTCP,Phát triển và quản lý bất động sản,HOSE,1035000000
86,BCP,CTCP Dược ENLIE,"Dược phẩm, Công nghệ sinh học và Khoa học thường thức",UPCoM,6000000
87,BCR,CTCP BCG Land,Phát triển và quản lý bất động sản,UPCoM,473799913
88,BCV,CTCP Du lịch và Thương mại Bằng Giang Cao Bằng - Vimico,Dịch vụ tiêu dùng,UPCoM,1800000
89,BDB,CTCP Sách và Thiết bị Bình Định,Truyền thông và giải trí,HNX,1126474
90,BDG,CTCP May mặc Bình Dương,Hàng tiêu dùng và trang trí,UPCoM,24799920
91,BDT,CTCP Xây lắp và Vật liệu Xây dựng Đồng Tháp,Nguyên vật liệu,UPCoM,38600000
92,BDW,CTCP Cấp thoát nước Bình Định,Dịch vụ tiện ích,UPCoM,12410800
93,BED,CTCP Sách và Thiết bị Trường học Đà Nẵng,Truyền thông và giải trí,HNX,3000000
94,BEL,CTCP Điện tử Biên Hòa,Công nghệ phần cứng và thiết bị,UPCoM,6000000
95,BFC,CTCP Phân bón Bình Điền,Nguyên vật liệu,HOSE,57167993
96,BGE,CTCP BCG Energy,Dịch vụ tiện ích,UPCoM,730000000
97,BGW,CTCP Nước sạch Bắc Giang,Dịch vụ tiện ích,UPCoM,18149446
98,BHA,CTCP Thủy điện Bắc Hà,Dịch vụ tiện ích,UPCoM,66000000
99,BHC,CTCP Bê tông Biên Hòa,Nguyên vật liệu,UPCoM,4500000
100,BHG,CTCP Chè Biển Hồ,"Thực phẩm, đồ uống và thuốc lá",UPCoM,8935643
101,BHI,Tổng Công ty cổ phần Bảo hiểm Sài Gòn - Hà Nội,Bảo hiểm,UPCoM,100000000
102,BHK,CTCP Bia Hà Nội - Kim Bài,"Thực phẩm, đồ uống và thuốc lá",UPCoM,3986000
103,BHN,Tổng Công ty cổ phần Bia - Rượu - Nước giải khát Hà Nội,"Thực phẩm, đồ uống và thuốc lá",HOSE,231800000
104,BHP,CTCP Bia Hà Nội - Hải Phòng,"Thực phẩm, đồ uống và thuốc lá",UPCoM,9179290
105,BIC,Tổng Công ty cổ phần Bảo hiểm Ngân hàng Đầu tư và Phát triển Việt Nam,Bảo hiểm,HOSE,117276895
106,BID,Ngân hàng TMCP Đầu tư và Phát triển Việt Nam,Tổ chức tín dụng,HOSE,6897515268
107,BIG,CTCP Big Invest Group,Phân phối và bán lẻ hàng lâu bền,UPCoM,15084689
108,BII,CTCP Louis Land,Bán lẻ thực phẩm và nhu yếu phẩm,UPCoM,57680000
109,BIO,CTCP Vắc xin và Sinh phẩm Nha Trang,"Dược phẩm, Công nghệ sinh học và Khoa học thường thức",UPCoM,8562000
110,BKC,CTCP Khoáng sản Bắc Kạn,Nguyên vật liệu,HNX,11737728
111,BKG,CTCP Đầu tư BKG Việt Nam,Nguyên vật liệu,HOSE,71609020
112,BLF,CTCP Thủy sản Bạc Liêu,"Thực phẩm, đồ uống và thuốc lá",UPCoM,11500000
113,BLI,Tổng Công ty cổ phần Bảo hiểm Bảo Long,Bảo hiểm,UPCoM,60000000
114,BLN,CTCP Vận tải và Dịch vụ Liên Ninh,Vận tải,UPCoM,5000000
115,BLT,CTCP Lương thực Bình Định,"Thực phẩm, đồ uống và thuốc lá",UPCoM,4000000
116,BMC,CTCP Khoáng sản Bình Định,Nguyên vật liệu,HOSE,12392630
117,BMD,CTCP Môi trường và Dịch vụ Đô thị Bình Thuận,Dịch vụ tiện ích,UPCoM,2753280
118,BMF,CTCP Vật liệu Xây dựng và Chất đốt Đồng Nai,Phân phối và bán lẻ hàng lâu bền,UPCoM,15848063
119,BMG,CTCP May Bình Minh,Hàng tiêu dùng và trang trí,UPCoM,5292000
120,BMI,Tổng Công ty cổ phần Bảo Minh,Bảo hiểm,HOSE,132642818
121,BMJ,CTCP Khoáng sản Miền Đông AHP,Nguyên vật liệu,UPCoM,104999978
122,BMK,CTCP Kỹ thuật nhiệt Mèo Đen,Tư liệu sản xuất,UPCoM,6800000
123,BMN,CTCP 715,Tư liệu sản xuất,UPCoM,2750000
124,BMP,CTCP Nhựa Bình Minh,Tư liệu sản xuất,HOSE,81860938
125,BMS,CTCP Chứng khoán Bảo Minh,Dịch vụ tài chính,UPCoM,71111425
126,BMV,CTCP Bột mỳ Vinafood 1,"Thực phẩm, đồ uống và thuốc lá",UPCoM,24200000
127,BNA,CTCP Tập đoàn Đầu tư Bảo Ngọc,"Thực phẩm, đồ uống và thuốc lá",HNX,31249394
128,BNW,CTCP Nước sạch Bắc Ninh,Dịch vụ tiện ích,UPCoM,37549391
129,BOT,CTCP BOT Cầu Thái Hà,Tư liệu sản xuất,UPCoM,59246800
130,BPC,CTCP VICEM Bao bì Bỉm Sơn,Nguyên vật liệu,HNX,3800000
131,BQB,CTCP Bia Hà Nội - Quảng Bình,"Thực phẩm, đồ uống và thuốc lá",UPCoM,5800000
132,BRC,CTCP Cao su Bến Thành,Xe và linh kiện,HOSE,12374997
133,BRR,CTCP Cao su Bà Rịa,Nguyên vật liệu,UPCoM,112500000
134,BRS,CTCP Dịch vụ Đô thị Bà Rịa,Dịch vụ tiện ích,UPCoM,4541950
135,BSA,CTCP Thủy điện Buôn Đôn,Dịch vụ tiện ích,UPCoM,66850975
136,BSC,CTCP Dịch vụ Bến Thành,Dịch vụ chuyên biệt và thương mại,HNX,3150747
137,BSD,"CTCP Bia, Rượu Sài Gòn - Đồng Xuân","Thực phẩm, đồ uống và thuốc lá",UPCoM,3000000
138,BSG,CTCP Xe khách Sài Gòn,Vận tải,UPCoM,60000000
139,BSH,CTCP Bia Sài Gòn - Hà Nội,"Thực phẩm, đồ uống và thuốc lá",UPCoM,18000000
140,BSI,CTCP Chứng khoán BIDV,Dịch vụ tài chính,HOSE,223060701
141,BSL,CTCP Bia Sài Gòn - Sông Lam,"Thực phẩm, đồ uống và thuốc lá",UPCoM,45000000
142,BSP,CTCP Bia Sài Gòn - Phú Thọ,"Thực phẩm, đồ uống và thuốc lá",UPCoM,12500000
143,BSQ,CTCP Bia Sài Gòn - Quảng Ngãi,"Thực phẩm, đồ uống và thuốc lá",UPCoM,45000000
144,BSR,CTCP Lọc hóa Dầu Bình Sơn,Năng lượng,HOSE,3100499616
145,BST,CTCP Sách và Thiết bị Bình Thuận,Truyền thông và giải trí,HNX,1100000
146,BT1,CTCP Bảo vệ Thực vật 1 Trung Ương,Nguyên vật liệu,UPCoM,5669959
147,BT6,CTCP Beton 6,Nguyên vật liệu,UPCoM,32993550
148,BTB,CTCP Bia Hà Nội - Thái Bình,"Thực phẩm, đồ uống và thuốc lá",UPCoM,7691226
149,BTD,CTCP Bê tông Ly tâm Thủ Đức,Nguyên vật liệu,UPCoM,6414100
150,BTG,CTCP Bao bì Tiền Giang,Nguyên vật liệu,UPCoM,1190000
151,BTH,CTCP Chế tạo Biến thế và Vật liệu Điện Hà Nội,Tư liệu sản xuất,UPCoM,25000000
152,BTN,CTCP Đầu tư Bitco Bình Định,Nguyên vật liệu,UPCoM,4465570
153,BTP,CTCP Nhiệt điện Bà Rịa,Dịch vụ tiện ích,HOSE,60485600
154,BTS,CTCP Xi măng VICEM Bút Sơn,Nguyên vật liệu,HNX,123559858
155,BTT,CTCP Thương mại Dịch vụ Bến Thành,Phân phối và bán lẻ hàng lâu bền,HOSE,13500000
156,BTU,CTCP Công trình Đô thị Bến Tre,Dịch vụ chuyên biệt và thương mại,UPCoM,3600000
157,BTV,CTCP Dịch vụ Du lịch Bến Thành,Dịch vụ tiêu dùng,UPCoM,25000000
158,BTW,CTCP Cấp nước Bến Thành,Dịch vụ tiện ích,HNX,9360000
159,BVB,Ngân hàng TMCP Bản Việt,Tổ chức tín dụng,UPCoM,551846215
160,BVG,CTCP Group Bắc Việt,Nguyên vật liệu,UPCoM,9750948
161,BVH,Tập đoàn Bảo Việt,Bảo hiểm,HOSE,742322764
162,BVL,CTCP BV Land,Tư liệu sản xuất,UPCoM,82788300
163,BVN,CTCP Bông Việt Nam,Hàng tiêu dùng và trang trí,UPCoM,5000000
164,BVS,CTCP Chứng khoán Bảo Việt,Dịch vụ tài chính,HNX,72233937
165,BWA,CTCP Cấp thoát nước và Xây dựng Bảo Lộc,Dịch vụ tiện ích,UPCoM,2700000
166,BWE,CTCP - Tổng công ty nước - môi trường Bình Dương,Dịch vụ tiện ích,HOSE,219928644
167,BWS,CTCP Cấp nước Bà Rịa - Vũng Tàu,Dịch vụ tiện ích,UPCoM,100007569
168,BXH,CTCP VICEM Bao bì Hải Phòng,Nguyên vật liệu,HNX,3012040
169,C12,CTCP Cầu 12,Tư liệu sản xuất,UPCoM,4850000
170,C21,CTCP Thế Kỷ 21,Phát triển và quản lý bất động sản,UPCoM,19336371
171,C22,CTCP 22,"Thực phẩm, đồ uống và thuốc lá",UPCoM,3550000
172,C32,CTCP CIC39,Nguyên vật liệu,HOSE,15030145
173,C47,CTCP Xây dựng 47,Tư liệu sản xuất,HOSE,36342269
174,C4G,CTCP Tập đoàn CIENCO4,Tư liệu sản xuất,UPCoM,357300754
175,C69,CTCP Xây dựng 1369,Phân phối và bán lẻ hàng lâu bền,HNX,61799972
176,C92,CTCP Xây dựng và Đầu tư 492,Tư liệu sản xuất,UPCoM,5312920
177,CAD,CTCP Chế biến và Xuất nhập khẩu Thủy sản Cadovimex,"Thực phẩm, đồ uống và thuốc lá",UPCoM,8799927
178,CAG,CTCP Cảng An Giang,Vận tải,HNX,13800000
179,CAN,CTCP Đồ hộp Hạ Long,"Thực phẩm, đồ uống và thuốc lá",HNX,5000000
180,CAP,CTCP Lâm Nông sản Thực phẩm Yên Bái,Nguyên vật liệu,HNX,15269965
181,CAR,CTCP Tập đoàn Giáo dục Trí Việt,Dịch vụ tiêu dùng,HNX,5059098
182,CAT,CTCP Thủy sản Cà Mau,"Thực phẩm, đồ uống và thuốc lá",UPCoM,9748579
183,CBI,CTCP Gang thép Cao Bằng,Nguyên vật liệu,UPCoM,43006366
184,CBS,CTCP Mía Đường Cao Bằng,"Thực phẩm, đồ uống và thuốc lá",UPCoM,5291868
185,CC1,Tổng Công ty Xây dựng Số 1 - CTCP,Tư liệu sản xuất,UPCoM,358507825
186,CC4,CTCP Đầu tư và Xây dựng Số 4,Tư liệu sản xuất,UPCoM,64000000
187,CCA,CTCP Xuất nhập khẩu Thuỷ sản Cần Thơ,"Thực phẩm, đồ uống và thuốc lá",UPCoM,15092326
188,CCC,CTCP Xây dựng CDC,Tư liệu sản xuất,HOSE,40250000
189,CCI,CTCP Đầu tư Phát triển Công nghiệp Thương mại Củ Chi,Phân phối và bán lẻ hàng lâu bền,HOSE,17743865
190,CCL,CTCP Đầu tư và Phát triển Đô thị Dầu khí Cửu Long,Phát triển và quản lý bất động sản,HOSE,59581418
191,CCM,CTCP khoáng sản và Xi măng Cần Thơ,Nguyên vật liệu,UPCoM,6199900
192,CCP,CTCP Cảng Cửa Cấm Hải Phòng,Phân phối và bán lẻ hàng lâu bền,UPCoM,2400000
193,CCR,CTCP Cảng Cam Ranh,Vận tải,HNX,24501817
194,CCT,CTCP Cảng Cần Thơ,Vận tải,UPCoM,28480000
195,CCV,CTCP Tư vấn Xây dựng Công nghiệp và Đô thị Việt Nam,Dịch vụ chuyên biệt và thương mại,UPCoM,1800000
196,CDC,CTCP Chương Dương,Tư liệu sản xuất,HOSE,21988716
197,CDG,CTCP Cầu Đuống,Nguyên vật liệu,UPCoM,3464995
198,CDH,CTCP Công trình Công cộng và Dịch vụ Du lịch Hải Phòng,Dịch vụ tiện ích,UPCoM,2000000
199,CDN,CTCP Cảng Đà Nẵng,Vận tải,HNX,99000000
200,CDO,CTCP Tư vấn Thiết kế và Phát triển Đô thị,Tư liệu sản xuất,UPCoM,31504975
201,CDP,CTCP Dược phẩm Trung ương Codupha,Dịch vụ và thiết bị chăm sóc sức khỏe,UPCoM,18270000
202,CDR,CTCP Xây dựng Cao su Đồng Nai,Tư liệu sản xuất,UPCoM,2133271
203,CEN,CTCP CENCON Việt Nam,Phân phối và bán lẻ hàng lâu bền,UPCoM,21712440
204,CEO,CTCP Tập đoàn C.E.O,Phát triển và quản lý bất động sản,HNX,540406432
205,CET,CTCP HTC Holding,Hàng tiêu dùng và trang trí,HNX,6050000
206,CFM,CTCP Đầu tư CFM,Dịch vụ tiêu dùng,UPCoM,2000000
207,CFV,CTCP Cà phê Thắng Lợi,"Thực phẩm, đồ uống và thuốc lá",UPCoM,8096000
208,CGV,CTCP Vinaceglass,Hàng tiêu dùng và trang trí,UPCoM,9499956
209,CH5,CTCP Xây dựng Số 5 Hà Nội,Tư liệu sản xuất,UPCoM,3732450
210,CHC,CTCP Cẩm Hà,Nguyên vật liệu,UPCoM,6731596
211,CHP,CTCP Thủy điện Miền Trung,Dịch vụ tiện ích,HOSE,146912668
212,CHS,CTCP Chiếu sáng Công cộng Thành phố Hồ Chí Minh,Tư liệu sản xuất,UPCoM,28400000
213,CI5,CTCP Đầu Tư Xây dựng Số 5,Tư liệu sản xuất,UPCoM,2700000
214,CIA,CTCP Dịch vụ Sân bay Quốc tế Cam Ranh,Vận tải,HNX,19709904
215,CID,CTCP Xây dựng và Phát triển Cơ sở Hạ tầng,Phát triển và quản lý bất động sản,UPCoM,1082000
216,CIG,CTCP COMA 18,Tư liệu sản xuất,HOSE,51039947
217,CII,CTCP Đầu tư Hạ tầng Kỹ thuật Thành phố Hồ Chí Minh,Phát triển và quản lý bất động sản,HOSE,547976583
218,CIP,CTCP Xây lắp và Sản xuất Công nghiệp,Tư liệu sản xuất,UPCoM,4545000
219,CJC,CTCP Cơ điện Miền Trung,Tư liệu sản xuất,HNX,8000000
220,CK8,CTCP Cơ khí 120,Nguyên vật liệu,UPCoM,3000000
221,CKA,CTCP Cơ Khí An Giang,Tư liệu sản xuất,UPCoM,3286404
222,CKD,CTCP Cơ khí Đông Anh LICOGI,Nguyên vật liệu,UPCoM,31000000
223,CKG,CTCP Tập đoàn Tư vấn Đầu tư Xây dựng Kiên Giang,Phát triển và quản lý bất động sản,HOSE,95259361
224,CKV,CTCP COKYVINA,Dịch vụ viễn thông,HNX,4050000
225,CLC,CTCP Cát Lợi,"Thực phẩm, đồ uống và thuốc lá",HOSE,26207583
226,CLG,CTCP Đầu tư và Phát triển Nhà đất COTEC,Tư liệu sản xuất,UPCoM,21150000
227,CLH,CTCP Xi măng La Hiên VVMI,Nguyên vật liệu,HNX,12000000
228,CLL,CTCP Cảng Cát Lái,Vận tải,HOSE,34000000
229,CLM,CTCP Xuất nhập khẩu Than - Vinacomin,Năng lượng,HNX,11000000
230,CLW,CTCP Cấp nước Chợ Lớn,Dịch vụ tiện ích,HOSE,13000000
231,CLX,CTCP Xuất nhập khẩu và Đầu tư Chợ Lớn (CHOLIMEX),Bán lẻ thực phẩm và nhu yếu phẩm,UPCoM,86600000
232,CMC,CTCP Đầu tư CMC,Tư liệu sản xuất,HNX,4561050
233,CMD,CTCP Vật liệu Xây dựng và Trang trí nội thất Thành phố Hồ Chí Minh,Nguyên vật liệu,UPCoM,15000000
234,CMF,CTCP Thực phẩm Cholimex,"Thực phẩm, đồ uống và thuốc lá",UPCoM,8100000
235,CMG,CTCP Tập đoàn Công nghệ CMC,Phần mềm và dịch vụ,HOSE,211339607
236,CMI,CTCP CMISTONE Việt Nam,Nguyên vật liệu,UPCoM,15002500
237,CMK,CTCP Cơ khí Mạo Khê - Vinacomin,Tư liệu sản xuất,UPCoM,1432578
238,CMM,CTCP Camimex,"Thực phẩm, đồ uống và thuốc lá",UPCoM,91849998
239,CMN,CTCP Lương thực Thực phẩm Colusa - Miliket,"Thực phẩm, đồ uống và thuốc lá",UPCoM,4800000
240,CMP,CTCP Cảng Chân Mây,Vận tải,UPCoM,32405415
241,CMS,CTCP Tập Đoàn CMH Việt Nam,Tư liệu sản xuất,HNX,25452500
242,CMT,CTCP Công nghệ Mạng và Truyền thông,Phần mềm và dịch vụ,UPCoM,8000000
243,CMV,CTCP Thương nghiệp Cà Mau,Phân phối và bán lẻ hàng lâu bền,HOSE,18155868
244,CMW,CTCP Cấp nước Cà Mau,Dịch vụ tiện ích,UPCoM,15534900
245,CMX,CTCP Camimex Group,"Thực phẩm, đồ uống và thuốc lá",HOSE,101898990
246,CNA,CTCP Tổng Công ty Chè Nghệ An,"Thực phẩm, đồ uống và thuốc lá",UPCoM,1673622
247,CNC,CTCP Công nghệ Cao Traphaco,"Dược phẩm, Công nghệ sinh học và Khoa học thường thức",UPCoM,11364325
248,CNG,CTCP CNG Việt Nam,Dịch vụ tiện ích,HOSE,35099625
249,CNN,CTCP Tư vấn Công nghệ Thiết bị và Kiểm Định Xây dựng - Coninco,Dịch vụ chuyên biệt và thương mại,UPCoM,8800000
250,CNT,CTCP Tập đoàn CNT,Phát triển và quản lý bất động sản,UPCoM,50392785
251,COM,CTCP Vật tư Xăng Dầu,Phân phối và bán lẻ hàng lâu bền,HOSE,14120628
252,CPA,CTCP Cà phê Phước An,"Thực phẩm, đồ uống và thuốc lá",UPCoM,23627990
253,CPC,CTCP Thuốc sát trùng Cần Thơ,Nguyên vật liệu,HNX,4303050
254,CPH,CTCP Phục vụ Mai táng Hải Phòng,Dịch vụ tiêu dùng,UPCoM,4400000
255,CPI,CTCP Đầu tư Cảng Cái Lân,Vận tải,UPCoM,36505000
256,CQN,CTCP Cảng Quảng Ninh,Vận tải,UPCoM,75049936
257,CQT,CTCP Xi măng Quán Triều VVMI,Nguyên vật liệu,UPCoM,25000000
258,CRC,CTCP Create Capital Việt Nam,Nguyên vật liệu,HOSE,60000000
259,CRE,CTCP Bất động sản Thế Kỷ,Phát triển và quản lý bất động sản,HOSE,463678534
260,CSC,CTCP Tập đoàn COTANA,Phát triển và quản lý bất động sản,HNX,37408982
261,CSI,CTCP Chứng khoán Kiến thiết Việt Nam,Dịch vụ tài chính,UPCoM,16800000
262,CSM,CTCP Công nghiệp Cao su Miền Nam,Xe và linh kiện,HOSE,103626467
263,CST,CTCP Than Cao Sơn - TKV,Năng lượng,HNX,42846773
264,CSV,CTCP Hóa chất Cơ bản Miền Nam,Nguyên vật liệu,HOSE,110499910
265,CT3,CTCP Đầu tư và Xây dựng Công trình 3,Tư liệu sản xuất,UPCoM,8799849
266,CT6,CTCP Công trình 6,Tư liệu sản xuất,UPCoM,6108078
267,CTA,CTCP Vinavico,Nguyên vật liệu,UPCoM,8454381
268,CTB,CTCP Chế tạo Bơm Hải Dương,Tư liệu sản xuất,HNX,13680000
269,CTD,CTCP Xây dựng Coteccons,Tư liệu sản xuất,HOSE,103633261
270,CTF,CTCP City Auto,Phân phối và bán lẻ hàng lâu bền,HOSE,95653859
271,CTG,Ngân hàng TMCP Công Thương Việt Nam,Tổ chức tín dụng,HOSE,5369991748
272,CTI,CTCP Đầu tư Phát triển Cường Thuận IDICO,Tư liệu sản xuất,HOSE,62999997
273,CTN,CTCP Xây dựng Công trình ngầm,Tư liệu sản xuất,UPCoM,6958345
274,CTP,CTCP Hòa Bình Takara,"Thực phẩm, đồ uống và thuốc lá",HNX,12099992
275,CTR,Tổng Công ty cổ phần Công trình Viettel,Dịch vụ viễn thông,HOSE,114385879
276,CTS,CTCP Chứng khoán Ngân hàng Công thương Việt Nam,Dịch vụ tài chính,HOSE,148738311
277,CTT,CTCP Chế tạo Máy - Vinacomin,Tư liệu sản xuất,HNX,4697351
278,CTW,CTCP Cấp thoát nước Cần Thơ,Dịch vụ tiện ích,UPCoM,28000000
279,CTX,Tổng Công ty cổ phần Đầu tư Xây dựng và Thương mại Việt Nam,Phát triển và quản lý bất động sản,UPCoM,78907276
280,CVN,CTCP Vinam,"Thực phẩm, đồ uống và thuốc lá",HNX,29699991
281,CVT,CTCP CMC,Nguyên vật liệu,HOSE,36690887
282,CX8,CTCP Đầu tư và Xây lắp Constrexim Số 8,Tư liệu sản xuất,HNX,2553771
283,CYC,CTCP Gạch men Chang Yih,Nguyên vật liệu,UPCoM,1990530
284,D11,CTCP Địa ốc 11,Phát triển và quản lý bất động sản,HNX,7338138
285,D2D,CTCP Phát triển Đô thị Công nghiệp số 2,Phát triển và quản lý bất động sản,HOSE,30304758
286,DAC,CTCP 382 Đông Anh,Nguyên vật liệu,UPCoM,1004974
287,DAD,CTCP Đầu tư và Phát triển Giáo dục Đà Nẵng,Truyền thông và giải trí,HNX,5000000
288,DAE,CTCP Sách Giáo dục tại Thành phố Đà Nẵng,Truyền thông và giải trí,HNX,1925658
289,DAG,CTCP Tập đoàn Nhựa Đông Á,Tư liệu sản xuất,UPCoM,60314112
290,DAH,CTCP Tập đoàn Khách sạn Đông Á,Dịch vụ tiêu dùng,HOSE,84200000
291,DAN,CTCP Dược Danapha,"Dược phẩm, Công nghệ sinh học và Khoa học thường thức",UPCoM,20938000
292,DAS,CTCP Máy - Thiết bị Dầu khí Đà Nẵng,Phân phối và bán lẻ hàng lâu bền,UPCoM,4200000
293,DAT,CTCP Đầu tư du lịch và Phát triển Thủy sản,"Thực phẩm, đồ uống và thuốc lá",HOSE,69228341
294,DBC,CTCP Tập đoàn Dabaco Việt Nam,"Thực phẩm, đồ uống và thuốc lá",HOSE,334669145
295,DBD,CTCP Dược - Trang thiết bị Y tế Bình Định (BIDIPHAR),"Dược phẩm, Công nghệ sinh học và Khoa học thường thức",HOSE,93593847
