STT,Mã CK▲,Tên công ty,Ngành,Sàn,Khối lượng NY/ĐKGD
2552,HTR,CTCP Đường sắt Hà Thái,Vận tải,OTC,1500700
2553,HTS,CTCP Thép Hương Thịnh,,OTC,14000000
2554,HTU,CTCP Môi trường và Công trình đô thị Hà Tĩnh,Dịch vụ chuyên biệt và thương mại,OTC,16438382
2555,HTW,CTCP Cấp nước Hà Tĩnh,Dịch vụ tiện ích,OTC,20400893
2556,HUD,Tổng Công ty Đầu tư Phát triển Nhà và Đô Thị,,Khác,0
2557,Hudeco,CTCP Đầu tư và Phát triển Giáo dục HUDECO,,OTC,1900000
2558,HUDKienGiang,Công ty TNHH Đầu tư và Phát triển Nhà Kiên Giang,,Khác,0
2559,Humic,CTCP Phân hữu cơ HUMIC Quảng Ngãi,,OTC,0
2560,HungPhu,CTCP Hưng Phú,,OTC,1800000
2561,HuongGiangCIC,CTCP Tư vấn Đầu tư và Xây dựng Hương Giang,,OTC,0
2562,HUTIC,CTCP Xây lắp Bưu điện Huế,,OTC,0
2563,HuuNghiDaNang,CTCP Sản xuất Thương mại Hữu Nghị Đà Nẵng,,OTC,0
2564,HuuNghiNgheAn,CTCP Hữu Nghị Nghệ An,,OTC,0
2565,HuuToan,CTCP Hữu Toàn,,OTC,0
2566,HUX,CTCP Khoáng sản Thừa Thiên Huế,Nguyên vật liệu,OTC,11338648
2567,HVAC,Công ty TNHH Kiểm toán Hùng Vương,,Khác,0
2568,HVB,CTCP Bảo hiểm Hùng Vương,Bảo hiểm,OTC,0
2569,HVC,CTCP Hưng Vượng,Nguyên vật liệu,OTC,6920750
2570,HVCapital,Công Ty TNHH Quản Lý Quỹ KIM Việt Nam,,OTC,0
2571,HVDC,CTCP Hưng Vượng Developer,,Khác,0
2572,HVIC,CTCP Tư vấn Đầu tư Hướng Việt,,Khác,0
2573,HVRC,CTCP Bất động sản Hướng Việt,,Khác,0
2574,HVS,CTCP Chứng khoán HVS Việt Nam,Dịch vụ tài chính,OTC,0
2575,HVUC,CTCP Thương mại Dịch vụ Tổng hợp Hoàn Vũ,,Khác,0
2576,I10,CTCP Đầu tư Xây dựng Số 10 IDICO,Tư liệu sản xuất,OTC,3500000
2577,IACAudit,Công ty TNHH Kiểm toán Tư vấn Độc Lập,,Khác,0
2578,IBFM,CTCP Quản lý Quỹ Đầu Tư Đỏ,,OTC,0
2579,IBN,CTCP In Báo Nghệ An,Truyền thông và giải trí,OTC,1776800
2580,ICJC,CTCP Đầu tư Xây lắp Thương mại 1,,OTC,0
2581,ICL,CTCP Xuất nhập khẩu Vĩnh Long,,OTC,0
2582,ICPC,CTCP Hàng Gia dụng Quốc tế,,OTC,0
2583,IDHC,CTCP Đầu tư và Phát triển Thuỷ Điện Đăkpsi,,Khác,0
2584,IDICOICT,CTCP Đầu Tư Xây dựng và Du lịch IDICO,,OTC,0
2585,IDN,CTCP In và Dịch vụ Đà Nẵng,Dịch vụ chuyên biệt và thương mại,OTC,1100000
2586,IDPCo,CTCP I.D.P,,OTC,0
2587,IDTC,CTCP IDTT,,Khác,0
2588,IDVVN,CTCP Đầu tư và Tư vấn IDV Việt Nam,,Khác,0
2589,IETC,CTCP Kinh doanh Thiết bị Công Nghiệp,,OTC,1614640
2590,IFC,CTCP Thực phẩm Công nghệ Sài Gòn,Phân phối và bán lẻ hàng lâu bền,OTC,9000000
2591,IFCVietNam,Công ty TNHH Kiểm toán và Tư vấn Tài chính Quốc tế,,Khác,0
2592,IFFHoldings,CTCP IFF Holdings,,Khác,0
2593,IFMC,CTCP Quản lý Quỹ Quốc tế,,OTC,0
2594,IFNC,CTCP Infinity Land,,Khác,0
2595,IGCC,CTCP Giáo dục Thành Thành Công,,Khác,0
2596,IGEC,CTCP Phát triển Giáo dục Igarten,,Khác,0
2597,IGL,Công ty TNHH Kiểm toán IGL,,Khác,0
2598,IKH,CTCP In Khoa học Kỹ thuật,Dịch vụ chuyên biệt và thương mại,OTC,1571000
2599,IMEXBINHDINH,CTCP Xuất nhập khẩu Bình Định,,OTC,0
2600,IMGC,CTCP Đầu tư IMG Huế,,Khác,0
2601,IMMA,Công ty TNHH Kiểm toán IMMANUEL,,Khác,0
2602,IMT,CTCP Xuất nhập khẩu Tổng hợp và Đầu tư Thành phố Hồ Chí Minh,Phân phối và bán lẻ hàng lâu bền,OTC,3000000
2603,Inconess,CTCP Dịch vụ Hỗ trợ Doanh nghiệp và Tư vấn Đầu tư,,OTC,0
2604,Indeco,CTCP Phát triển Hạ tầng Khu Công nghiệp Tây Ninh,,OTC,0
2605,Indovinabank,Ngân hàng TNHH Indovina,Tổ chức tín dụng,Khác,0
2606,INEXIM,CTCP Xuất nhập khẩu Hàng Công nghiệp,,Khác,0
2607,IneximDaklak,CTCP Đầu tư Xuất nhập khẩu Đăklăk,,OTC,0
2608,INFC,CTCP Giải pháp Số hóa Infinity,,Khác,0
2609,InPhucYen,CTCP In Phúc Yên,,OTC,0
2610,InSaiGon,CTCP Thương mại Dịch vụ Quảng Cáo In Sài Gòn,,OTC,0
2611,InSo7,CTCP In Số 7,,OTC,2000000
2612,InTaiChinh,CTCP In Tài chính,,OTC,0
2613,InThongNhat,CTCP In và Thương mại Thống Nhất,,OTC,0
2614,InTienGiang,CTCP In Tiền Giang,,OTC,0
2615,Intimex,CTCP Tập đoàn Intimex,,OTC,0
2616,Intimexco,CTCP Intimex Việt Nam,,OTC,0
2617,InTranPhu,CTCP In Trần Phú,,OTC,0
2618,InVanHoaPham,CTCP In và Văn Hóa Phẩm,,OTC,0
2619,INVESTCOM,CTCP Đầu tư Investcom,,OTC,0
2620,INVESTREAL,CTCP Đầu tư và Kinh doanh Bất động sản,,OTC,7000000
2621,IP1C,CTCP Phong Ðiện Ia Pết Đak Đoa số 1,,Khác,0
2622,IP2C,CTCP Phong Ðiện Ia Pết Đak Đoa số 2,,Khác,0
2623,IPAM,Công ty TNHH MTV Quản lý Quỹ đầu tư Chứng khoán I.P.A,,Khác,0
2624,IPC,Công ty TNHH MTV Phát triển Công nghiệp Tân Thuận,,Khác,0
2625,IPDC,CTCP IMG Phước Đông,,Khác,0
2626,IPH,CTCP In và Phát hành biểu mẫu Thống kê,Dịch vụ chuyên biệt và thương mại,OTC,1000000
2627,IREC,Công ty TNHH Bất động sản Industry,,Khác,0
2628,IRS,CTCP Chứng khoán UP,Dịch vụ tài chính,OTC,13500000
2629,ISC,CTCP Chứng khoán Công nghiệp Việt Nam,Dịch vụ tài chính,OTC,0
2630,ITCC,CTCP Đầu tư Xây dựng Hạ tầng và Giao thông,,Khác,0
2631,ITLC,CTCP Giao nhận và Vận chuyển In Do Trần,,Khác,0
2632,ITOAudit,Công ty TNHH Kiểm toán I.T.O,,Khác,0
2633,ITPC,Công Ty TNHH Đầu Tư Phú Thịnh Phát,,Khác,0
2634,IVAM,CTCP Quản lý Quỹ Trí tuệ Việt Nam,,OTC,11600000
2635,JBC5,CTCP Vật liệu Xây dựng và Xây lắp Số 5,,OTC,0
2636,JHIC,CTCP Doanh nghiệp Xã hội Ivy Care,,Khác,0
2637,JIVF,Công ty Tài chính TNHH MTV Quốc tế Việt Nam JACCS,Tổ chức tín dụng,Khác,0
2638,JPMorgan,Ngân hàng JP Morgan Chase N.A Chi Nhánh Thành phố Hồ Chí Minh,Tổ chức tín dụng,Khác,0
2639,JSC,CTCP Đầu tư và Xây dựng Cầu đường Hà Nội,Nguyên vật liệu,OTC,1550000
2640,JSI,Công ty TNHH Chứng khoán Nhật Bản,Dịch vụ tài chính,OTC,4100000
2641,KAFI,CTCP Chứng khoán KAFI,Dịch vụ tài chính,OTC,0
2642,KAL,CTCP Nhôm Khánh Hoà,,OTC,0
2643,KASJSC,CTCP Xây lắp và Dịch vụ Bưu điện Kiên Giang,,OTC,0
2644,KBE,CTCP Sách Thiết bị Trường học Kiên Giang,Phân phối và bán lẻ hàng lâu bền,OTC,1231060
2645,KBT,CTCP Gạch ngói Kiên Giang,Nguyên vật liệu,OTC,3001699
2646,KCNBacGiang,Công ty Phát triển Hạ tầng Khu Công nghiệp Bắc Giang,,Khác,0
2647,KDCC,Công ty TNHH Đầu tư và Kinh doanh Bất động sản Khu Đông,,Khác,0
2648,KDF,CTCP Thực phẩm Đông lạnh KIDO,"Thực phẩm, đồ uống và thuốc lá",Khác,56000000
2649,KDPC,Công ty TNHH Khu Đông - Phú Quốc,,Khác,0
2650,KGRC,CTCP Liên doanh Kangaroo Quốc tế,,Khác,0
2651,KGTICJC,CTCP Xây dựng Giao thông Thuỷ Lợi Kiên Giang,,OTC,0
2652,KGU,CTCP Phát triển Đô thị Kiên Giang,Dịch vụ tiện ích,OTC,1489573
2653,KHA,CTCP Đầu tư và Dịch vụ Khánh Hội,Phát triển và quản lý bất động sản,OTC,14120309
2654,KHAFEED,Công ty TNHH MTV Thức ăn Chăn nuôi Khatoco,,Khác,0
2655,Khaithacda,CTCP Khai Thác Đá Thừa Thiên Huế,,OTC,1000000
2656,KhanhTan,CTCP Khánh Tân,,OTC,0
2657,KHATOCO,CTCP In Bao bì Khatoco,,OTC,0
2658,KHB,CTCP Khoáng sản Hòa Bình,Nguyên vật liệu,OTC,29075499
2659,KHLC,Công ty TNHH Kreves Halla Land,,Khác,0
2660,KHOANGSAN4,CTCP Phát triển Khoáng sản 4,,OTC,0
2661,KhoangSanPhuYen,CTCP Khoáng sản Phú Yên,,OTC,0
2662,KhoangSanSongDa,CTCP Khai Thác và Chế Biến Khoáng Sản Sông Đà,,OTC,0
2663,KhoangsanTD,CTCP Khoáng sản Thiên Đức,,Khác,0
2664,KhoaVietTiep,CTCP Khóa Việt - Tiệp,,OTC,0
2665,KHTC,CTCP Xây dựng Kiến Hưng Thịnh,,Khác,0
2666,Kido,CTCP KIDO,,OTC,6900000
2667,KiemNghia,CTCP Kiềm Nghĩa,,OTC,0
2668,KienGiangPetro,CTCP Dầu khí Dương Đông Kiên Giang,,OTC,0
2669,KienHungAudit,Công ty TNHH Kế toán Kiểm toán và Tin học Kiến Hưng,,Khác,0
2670,KienTrucADC,CTCP Xây dựng Trang trí Kiến trúc ADC,,OTC,0
2671,Kigitraco,CTCP Kinh doanh Nông Sản Kiên Giang,,OTC,4000000
2672,KIGIWI,CTCP Vận tải Thuỷ Bộ Kiên Giang,,OTC,2114600
2673,KimAnh,CTCP Chè Kim Anh,,OTC,1049980
2674,KimKhiBacThai,CTCP Kim khí Bắc Thái,,OTC,0
2675,KimLien,CTCP Du lịch Kim Liên,,OTC,0
2676,KimOanh,CTCP Dịch vụ Thương mại và Xây dựng Địa ốc Kim Oanh,,OTC,0
2677,KimTuThap,CTCP Công nghệ Mới Kim Tự Tháp Việt Nam,,OTC,4000000
2678,KinhDoLand,CTCP Địa Ốc Kinh Đô,,OTC,10000000
2679,KIS,CTCP Chứng khoán KIS Việt Nam,Dịch vụ tài chính,OTC,26364600
2680,KISUCO,CTCP Mía Đường Kiên Giang,,OTC,0
2681,KLM,CTCP Kim loại màu Nghệ Tĩnh,Nguyên vật liệu,OTC,3885000
2682,KLS,CTCP Chứng khoán Kim Long,Dịch vụ tài chính,Khác,202500000
2683,KMF,CTCP Mirae Fiber,Hàng tiêu dùng và trang trí,Khác,0
2684,KMLC,CTCP Du lịch sinh thái Kim Lan,,Khác,0
2685,KNCC,Công ty TNHH KN Cam Ranh,,Khác,0
2686,KNITEXIM,CTCP Haprosimex Thăng Long,,OTC,0
2687,KNVC,Công ty TNHH Đầu tư và Phát triển Điện mặt trời KN Vạn Ninh,,Khác,0
2688,KPC,CTCP Đầu tư Sản xuất Thương mại Kim Phong,,OTC,0
2689,KPMG,Công ty TNHH KPMG Việt Nam,,Khác,0
2690,KRESTON,Công ty TNHH Kiểm toán KRESTON ACA Việt Nam,,Khác,0
2691,KSA,CTCP Công nghiệp khoáng sản Bình Thuận,Nguyên vật liệu,OTC,93427360
2692,KSC,CTCP Muối Khánh Hòa,"Thực phẩm, đồ uống và thuốc lá",OTC,3739823
2693,KSE,CTCP Xuất khẩu Thủy sản Khánh Hòa,"Thực phẩm, đồ uống và thuốc lá",OTC,1476000
2694,KSG,CTCP Khoáng sản và Vật liệu Xây dựng Gia Lai,,OTC,0
2695,KSHCPhuTho,Xí nghiệp Khai thác - Dịch vụ Khoáng sản và Hóa chất Phú Thọ,,Khác,0
2696,KSIAudit,Công ty TNHH Kiểm toán KSI Việt Nam,,Khác,0
2697,KSK,CTCP Khoáng sản Luyện kim màu,Nguyên vật liệu,OTC,23888000
2698,KSS,CTCP Khoáng sản Na Rì Hamico,Nguyên vật liệu,OTC,49432500
2699,KTAChau,Công ty TNHH Kiểm toán Á Châu,,Khác,0
2700,KTB,CTCP Đầu tư Khoáng sản Tây Bắc,Nguyên vật liệu,OTC,40200000
2701,KTBX,CTCP Bến xe KonTum,,OTC,0
2702,KTCAudit,Công ty TNHH Kiểm toán và Tư vấn Doanh Nghiệp KTC,,Khác,0
2703,KTIC,CTCP Kita Invest,,Khác,0
2704,KTMC,CTCP Kim Tín MDF,,Khác,0
2705,KTMienTrung,Công ty TNHH Kiểm toán Miền Trung,,Khác,0
2706,KTQuocgia,Công ty TNHH Kiểm toán Độc lập Quốc gia Việt Nam,,Khác,0
2707,KTSKienGiang,Công ty TNHH MTV Thương mại Dịch vụ Kiên Giang,,Khác,0
2708,KTU,CTCP Môi trường Đô thị Kon Tum,Dịch vụ chuyên biệt và thương mại,OTC,1210330
2709,KTV,Công ty TNHH Kiểm toán KTV,,Khác,0
2710,KTW,CTCP Cấp nước Kon Tum,Dịch vụ tiện ích,OTC,8330200
2711,KTXaydungVN,Công ty TNHH Kiểm toán Tư vấn Xây dựng Việt Nam,,Khác,0
2712,KVAC,Công ty TNHH Kiểm toán Tư vấn Khang Việt,,Khác,0
2713,KVIC,CTCP Đầu tư Kiến Vàng,,Khác,0
2714,KVS,CTCP Chứng khoán BIS,Dịch vụ tài chính,OTC,4000000
2715,LACC,CTCP Thương mại Dịch vụ Hoa Lâm An,,Khác,0
2716,LacHong,CTCP Đầu tư Lạc Hồng,,OTC,0
2717,LamDong,CTCP Xây dựng Số 1 Lâm Đồng,,OTC,0
2718,LamNghiepBD,Công ty TNHH MTV Lâm nghiệp Bình Dương,,Khác,0
2719,LamSankienGiang,CTCP Nông Lâm Sản Kiên Giang,,OTC,6393310
2720,LaNga,CTCP Đầu tư La Ngà,,OTC,1500000
2721,Lanmak,CTCP Đầu tư Xây dựng Bất động sản Lanmak,,OTC,0
2722,LaoDongQuocTe,CTCP Xây dựng và Cung ứng Lao động Quốc tế,,OTC,0
2723,LaoVietBank,Ngân hàng Liên doanh Lào - Việt,Tổ chức tín dụng,Khác,0
2724,Lasotra,CTCP Thương mại Lạng Sơn,,OTC,0
2725,LBC,CTCP Thương mại - Đầu tư Long Biên,Phân phối và bán lẻ hàng lâu bền,OTC,1500000
2726,LBMi,CTCP Lê Bảo Minh,,Khác,0
2727,LCLC,Công Ty TNHH Kinh doanh Bất động sản LC,,Khác,0
2728,LCO,CTCP Licogi 16.1,,OTC,1500000
2729,LCW,CTCP Nước sạch Lai Châu,Dịch vụ tiện ích,OTC,21586514
2730,LDTC,CTCP Lâu đài Trắng,,Khác,0
2731,LEC,CTCP Bất động sản Điện lực Miền Trung,Hàng tiêu dùng và trang trí,OTC,26100000
2732,LECC,CTCP Lec Group,,Khác,0
2733,LeQuanTech,Công ty TNHH Kỹ thuật Lê Quân,,Khác,0
2734,LHLC,CTCP Tập đoàn Bất động sản Lan Hưng,,Khác,0
2735,LHRC,Công ty TNHH Đầu tư Bất động sản Long Hưng Phát,,Khác,0
2736,Liberty,CTCP Quê Hương - Liberty,,OTC,64900000
2737,LibertyInsurance,Công ty TNHH Bảo hiểm Phi Nhân thọ Liberty Việt Nam,Bảo hiểm,Khác,0
2738,LIBREXCO,Công ty TNHH MTV Chăn nuôi Tiền Giang,,Khác,5100000
2739,Licogi16,CTCP Licogi 16 M&C,,OTC,0
2740,Licogi162,CTCP Xây dựng Licogi 16.2,,OTC,0
2741,Licogi165,CTCP Licogi 16.5,,OTC,0
2742,Licogi169,CTCP Licogi 16.9,,OTC,3600000
2743,Lidovit,CTCP Công nghiệp và Thương mại LIDOVIT,,OTC,0
2744,LienThaiBinhDuong,Công ty TNHH Xuất nhập khẩu Liên Thái Bình Dương,,Khác,0
2745,LIKSIN,Tổng Công ty Công nghiệp - In - Bao bì Liksin TNHH MTV,,Khác,0
2746,LilamaHN,CTCP Lilama Hà Nội,,OTC,0
2747,LilamaPhaLai,CTCP Lilama 69-1 Phả Lại,,OTC,0
2748,LinhGas,CTCP Linh Gas Việt Nam,,OTC,0
2749,LKHC,CTCP Dịch vụ Đầu tư Lucky House,,Khác,0
2750,LLFC,Công ty TNHH Kinh doanh Nội thất Luxury Living,,Khác,0
2751,LLPC,Công ty TNHH Đầu tư Kinh doanh Bất động sản Liên Lập,,Khác,0
2752,LMBC,Công ty TNHH Đầu tư Lemanh Brothers,,Khác,0
2753,LMR,CTCP Liên Minh,,OTC,10000000
2754,LOGOS,Công ty TNHH với Kế toán và Kiểm toán,,Khác,0
2755,LongTho,CTCP Long Thọ,,OTC,0
2756,LotusIMC,CTCP Quản lý Quỹ Bông Sen,,OTC,0
2757,LPBankI,Tổng CTCP Bảo hiểm LPBank,Bảo hiểm,Khác,0
2758,LPBS,CTCP Chứng khoán LPBank,Dịch vụ tài chính,OTC,12500000
2759,LPCC,CTCP Xây dựng Đầu tư và Phát triển Lĩnh Phong - C.O.N.I.C,,Khác,0
2760,LSCC,CTCP Xây dựng và Thương mại Lam Sơn,,Khác,0
2761,LTCC,CTCP Xi măng Long Thành,,Khác,0
2762,LTLC,Công ty TNHH Đầu tư - Kinh doanh Bất động sản Long Thượng Lộc,,Khác,0
2763,LTRC,CTCP Long Thành Riverside,,Khác,0
2764,LungLo3,Công ty TNHH MTV Lũng Lô 3,,Khác,0
2765,LuongMyPoultry,CTCP Giống Gia Cầm Lương Mỹ,,OTC,0
2766,LuongSonHoaBinh,CTCP Xi măng Vinaconex Lương Sơn Hoà Bình,,OTC,0
2767,LVC,CTCP Quản lý Quỹ Lộc Việt,,OTC,0
2768,LVDC,CTCP Lavida Invest,,Khác,0
2769,LVN,CTCP Len Việt Nam,,OTC,0
2770,LVPC,CTCP Cảng quốc tế Lào - Việt,,Khác,0
2771,LVRC,Công ty TNHH Bất động sản Lan Việt,,Khác,0
2772,LWPC,Công ty Thế giới Lào,,Lào,0
2773,LWS,CTCP Cấp nước Tỉnh Lào Cai,Dịch vụ tiện ích,OTC,17717665
2774,LXS,CTCP Chứng khoán Lanexang,,Lào,0
2775,LYF,CTCP Lương thực Lương Yên,"Thực phẩm, đồ uống và thuốc lá",OTC,300
2776,MAAC,Công ty TNHH Quản Lý - Kiểm toán - Tư vấn M.A.A.C,,Khác,0
2777,MACC,Công ty TNHH Marcus,,Khác,0
2778,MAFC,Công ty Tài chính TNHH MTV Mirae Asset,Tổ chức tín dụng,Khác,0
2779,MAFEQI,Quỹ đầu tư Cổ phiếu Manulife,,OTC,6511338
2780,MAFPF1,Quỹ đầu tư tăng trưởng Manulife,Dịch vụ tài chính,Khác,21409530
2781,MaiDong,Công ty TNHH MTV Mai Động,,Khác,0
2782,Manulife,Công ty TNHH Manulife (Việt Nam),Bảo hiểm,Khác,0
2783,ManulifeAM,Công ty TNHH Quản lý Quỹ Manulife Investment (Việt Nam),,Khác,0
2784,MatTroiDo,CTCP Đầu tư Thương mại Quốc tế Mặt Trời Đỏ,,Khác,0
2785,MAX,CTCP Khai khoáng và Cơ khí Hữu Nghị Vĩnh Sinh,Nguyên vật liệu,OTC,7200000
2786,MayDongA,CTCP Dệt may Đông Á,,OTC,3650000
2787,MayLongAn,CTCP Cơ khí và Chế tạo Máy Long An,,OTC,0
2788,MayPhuongDong,CTCP May Phương Đông,,OTC,0
2789,MaySaiGon2,CTCP May Sài Gòn 2,,OTC,0
2790,MaySaiGon3,CTCP May Sài Gòn 3,,OTC,0
2791,MayThangLong,CTCP May Thăng Long,,OTC,2330670
2792,MayVietThang,CTCP May Việt Thắng,,OTC,1600000
2793,MayVietThinh,CTCP May Việt Thịnh,,OTC,26000000
2794,Mazars,Công ty TNHH Mazars Việt Nam,,Khác,0
2795,MBAgeasLife,Công ty TNHH Bảo hiểm nhân thọ MB Ageas,Bảo hiểm,Khác,0
2796,MBCapital,CTCP Quản lý Quỹ đầu tư MB,,OTC,0
2797,MBDC,Công ty TNHH Đầu tư và Tư vấn Quản lý Biển Đông,,Khác,0
2798,MBEF1,Quỹ đầu tư Cổ phần MB Capital 1,,Khác,0
2799,MBKE,Công ty TNHH Chứng khoán Maybank,Dịch vụ tài chính,Khác,20000000
2800,MBLC,CTCP MBLand Tonkin,,Khác,0
2801,MBVF,Quỹ đầu tư Giá trị MB Capital,,OTC,11907937
2802,MC3,CTCP Khoáng sản 3 - Vimico,Nguyên vật liệu,OTC,3500000
2803,MCCC,Công Ty TNHH Cung ứng và Thương mại Mùa Xuân,,Khác,0
2804,Mccons,CTCP Thi công Cơ giới và Dịch vụ,,OTC,3510000
2805,MCD,CTCP Môi trường và Công trình Đô thị Đông Hà,Dịch vụ tiện ích,OTC,332019
2806,MCDVietNam,CTCP Xây dựng Năng lượng MCD Việt Nam,,Khác,0
2807,MCHC,Công ty TNHH Masan Consumer Holdings,,Khác,0
2808,MCI,CTCP Đầu tư Xây dựng và Phát triển Vật liệu IDICO,Tư liệu sản xuất,OTC,3500000
2809,MCJ,CTCP Thiết bị Phụ tùng,,OTC,5000000
2810,MCL,CTCP Phát triển Nhà và Sản xuất Vật liệu Xây dựng Chí Linh,Nguyên vật liệu,OTC,2220000
2811,MCS,CTCP Thi công Cơ giới Xây lắp,,OTC,3500000
2812,MCT,CTCP Kinh doanh Vật Tư và Xây dựng,Tư liệu sản xuất,OTC,2500000
2813,MCV,CTCP Cavico Việt Nam Khai thác mỏ và Xây dựng,Tư liệu sản xuất,OTC,12092161
2814,MDB,Ngân hàng TMCP Phát triển Mê Kông,Tổ chức tín dụng,Khác,375000000
2815,MDFVINAFOR,Công ty TNHH MDF Vinafor – Tân An Hòa Bình,,Khác,0
2816,MDN,CTCP Tổng Công ty May Đồng Nai,Hàng tiêu dùng và trang trí,OTC,10935584
2817,MDT,CTCP Cơ khí mỏ và Đóng tàu - TKV,Tư liệu sản xuất,OTC,1510000
2818,MEBI,CTCP Dược phẩm và Sinh học Y tế,,OTC,0
2819,MECO,CTCP Cơ điện Luyện kim Thái Nguyên,,OTC,0
2820,Medico,CTCP Phát triển khoáng Sản,,OTC,0
2821,Mediplast,CTCP Nhựa Y tế Mediplast,,OTC,0
2822,MEG,CTCP Megram,"Dược phẩm, Công nghệ sinh học và Khoa học thường thức",OTC,44000000
2823,MekongCapital,Công ty TNHH Tư vấn Mekong Capital,,Khác,0
2824,MEKONIMEX,CTCP Nông sản Thực phẩm Xuất khẩu Cần Thơ,,OTC,0
2825,MHAuditing,Công ty TNHH Kiểm toán M&H,,Khác,0
2826,MHB,Ngân hàng TMCP Phát triển Nhà Đồng bằng sông Cửu Long,Tổ chức tín dụng,Khác,306215200
2827,MHBS,CTCP Chứng khoán MHB,Dịch vụ tài chính,OTC,14000000
2828,MHDAudit,Công ty TNHH Kiểm toán MHD,,Khác,0
2829,MHP,CTCP Môi trường và Dịch vụ Đô thị Việt Trì,Dịch vụ chuyên biệt và thương mại,OTC,3583140
2830,MHY,CTCP Môi trường và Công trình Đô thị Hưng Yên,Dịch vụ chuyên biệt và thương mại,OTC,31800
2831,MiaDuongBenTre,CTCP Mía đường Bến Tre,,OTC,0
2832,MiaDuongNongCong,CTCP Mía Đường Nông Cống,,OTC,0
2833,MiaDuongSonDuong,CTCP Mía đường Sơn Dương,,OTC,0
2834,MienTrung,CTCP Đầu tư và Phát triển Miền Trung,,OTC,0
2835,MIH,CTCP Xuất nhập khẩu Khoáng sản Hà Nam,Nguyên vật liệu,OTC,4000000
2836,MINEXCO,CTCP Khoáng sản và Đầu tư Khánh Hòa,,OTC,0
2837,MinhPhuc,CTCP Sản xuất và Thương mại Minh Phúc,,OTC,4757770
2838,MinhVietCapital,CTCP Quản lý Quỹ PAVO CAPITAL,,OTC,0
2839,MIPC,CTCP Năng lượng Thiên niên Kỷ,,Khác,0
2840,MiraeAsset,CTCP Chứng khoán Mirae Asset (Việt Nam),Dịch vụ tài chính,Khác,0
2841,MIREX,CTCP Khoáng sản và Luyện kim Việt Nam,,OTC,0
2842,MIVC,CTCP Đầu tư MHC,,Khác,0
2843,MIWACO,CTCP Nước khoáng và Du Lịch Sơn Kim,,OTC,0
2844,MJC,CTCP Thương mại Mộc Hóa,Phân phối và bán lẻ hàng lâu bền,OTC,1596620
2845,MKDC,Công ty TNHH Minh Khang Điền,,Khác,0
2846,MKHC,Công ty TNHH Đầu tư Phát triển Mỹ Khánh,,Khác,0
2847,MKIC,CTCP Tư vấn Đầu tư và Kỹ thuật Mê Kông,,Khác,0
2848,MKT,CTCP Dệt Minh Khai,Hàng tiêu dùng và trang trí,OTC,3200000
2849,MLG,CTCP Tập đoàn Mai Linh,,OTC,70716427
2850,MLN,CTCP Mai Linh Miền Bắc,Vận tải,Khác,48625332
2851,MMC,CTCP khoáng Sản Mangan,Nguyên vật liệu,Khác,3160000
2852,MMJC,CTCP Marina Mekong,,Khác,0
2853,MNAC,Công ty TNHH Mavin Austfeed Nghệ An,,Khác,0
2854,MNC,CTCP Mai Linh Miền Trung,Vận tải,Khác,9279261
2855,MNRC,CTCP Đầu tư và Dịch vụ Đất Xanh Miền Nam,,Khác,0
2856,MNVC,Công ty TNHH Thương mại và Dịch vụ Mivi Việt Nam,,Khác,0
2857,MNXC,CTCP Xuất nhập khẩu Khoáng sản,,Khác,0
2858,MobiFone,Tổng Công ty Viễn thông MobiFone - Công ty TNHH MTV,,Khác,0
2859,MOBITECHS,CTCP Dịch vụ Kỹ thuật và Hạ tầng Mạng Thông Tin Di Động,,OTC,0
2860,MotorVN,CTCP United Motor Việt Nam,,OTC,37500000
2861,MRBC,CTCP Maroon Bells,,Khác,0
2862,MREC,CTCP Bất động sản Mỹ,,Khác,0
2863,MRVC,Công ty TNHH Kinh doanh Bất động sản Dream City Villas,,Khác,0
2864,MSC,CTCP Dịch vụ Phú Nhuận,Phân phối và bán lẻ hàng lâu bền,OTC,22500000
2865,MSFC,Công ty Tài chính TNHH MB Shinsei,,Khác,0
2866,MSGS,Công ty TNHH chứng khoán JB Việt Nam,Dịch vụ tài chính,Khác,30000000
2867,MSHC,CTCP Điện mặt trời Mỹ Sơn 2,,Khác,0
2868,MSI,CTCP Chứng khoán KB Việt Nam,Dịch vụ tài chính,OTC,0
2869,MSMC,CTCP Điện mặt trời Mỹ Sơn 1,,Khác,0
2870,MTDC,CTCP Đầu tư Đường Mặt Trời,,Khác,0
2871,MTJ,CTCP Tư vấn và Xây dựng công trình Miền Trung,,OTC,4500000
2872,MTJC,CTCP Đá Mỹ thuật,,Khác,0
2873,MTM,CTCP mỏ và Xuất nhập khẩu Khoáng sản Miền Trung,Nguyên vật liệu,OTC,31000000
2874,MTPC,CTCP Xây dựng Minh Trường Phú,,Khác,0
2875,MTSC,CTCP Đầu tư Metro Star,,Khác,0
2876,MTUC,Công ty TNHH Đầu tư và Phát triển Đô thị Minh Tân,,Khác,0
2877,MVJC,CTCP Đầu tư Địa ốc Mai Viên,,Khác,0
2878,MVY,CTCP Môi trường và Dịch vụ Đô Thị Vĩnh Yên,Dịch vụ chuyên biệt và thương mại,OTC,5969946
2879,MXC,Trung tâm Nông nghiệp Mùa Xuân,Nguyên vật liệu,OTC,700938
2880,MyKhe,CTCP Mỹ Khê Việt Nam,,OTC,0
2881,MYPC,Công ty TNHH Đầu tư và Kinh doanh Địa ốc Mỹ Phú,,Khác,0
2882,MyPhamSG,CTCP Mỹ phẩm Sài Gòn,,OTC,0
2883,NAKC,CTCP Công nghệ Khải An,,Khác,0
2884,Nakydaco,CTCP Dầu thực vật Tân Bình,,OTC,4310000
2885,NALC,Công ty TNHH Nam Land,,Khác,0
2886,NamChien,CTCP Thủy điện Nậm Chiến,,OTC,0
2887,NAMCO,CTCP Khoáng sản Nghệ An,,OTC,0
2888,NamKhang,CTCP Đầu tư Nam Khang,,OTC,8300000
2889,NamMuc,CTCP Thủy điện Nậm Mức,,OTC,0
2890,NamThaiSon,CTCP Nam Thái Sơn,,Khác,0
2891,NamThi,CTCP Thủy điện Nậm Thi - Sông Đà 7,,OTC,0
2892,NamTrieu,CTCP Công nghiệp Tàu thủy và Xây dựng Nam Triệu,,OTC,0
2893,NamVietOil,CTCP Lọc Hoá Dầu Nam Việt,,OTC,0
2894,NANC,CTCP Đầu tư và Kinh doanh Nam An,,Khác,0
2895,Natraco,CTCP Thương mại Nghệ An,,OTC,0
2896,NBCC,Công ty TNHH Tư vấn Đầu tư Nguyên Bình,,Khác,0
2897,NBN,CTCP Xây dựng Công trình 545,,OTC,0
2898,NBR,CTCP Đường sắt Nghĩa Bình,Vận tải,OTC,1806000
2899,NBS,CTCP Bến xe Nghệ An,Vận tải,OTC,3153200
2900,NCGC,CTCP Tập đoàn Nam Cường Hà Nội,,Khác,0
2901,NCLC,Công ty TNHH Đầu tư và Phát triển Bất động sản Nice Star,,Khác,0
2902,NCP,CTCP Nhiệt điện Cẩm Phả - TKV,Dịch vụ tiện ích,Khác,196980622
2903,NCRC,CTCP Câu lạc bộ Du thuyền và Nghỉ dưỡng Cam Ranh,,Khác,0
2904,NDTC,Công ty TNHH Nam Đại Thành Phú Quốc,,Khác,0
2905,NELC,CTCP Công nghệ Thương mại Giga 1,,Khác,0
2906,NEOC,CTCP Neo Floor,,Khác,0
2907,NFSC,CTCP Nova Final Solution,,Khác,0
2908,NGMC,Công ty TNHH Đầu tư và Bất động sản Ngọc Minh,,Khác,0
2909,NgocHy,CTCP Dịch vụ In Trần Ngọc Hy Cà Mau,,OTC,0
2910,NgocTung,CTCP Sản xuất Thương mại Dịch vụ Ngọc Tùng,,OTC,0
2911,NgoVietNam,CTCP Đầu tư Phát triển Ngô Việt Nam,,OTC,0
2912,NhaBeTech,CTCP Tư vấn Công nghệ Nhà Bè,,OTC,0
2913,NHACANTHO,Công ty TNHH MTV Phát triển và Kinh doanh Nhà Thành phố Cần Thơ,,Khác,0
2914,NhanLuc,CTCP Phát triển Nguồn nhân lực LOD,,OTC,0
2915,NhaSaiGon,CTCP Đầu tư Xây dựng và Kinh doanh Nhà Sài Gòn,,OTC,0
2916,NhatMinhAudit,Công ty TNHH Kiểm toán Nhất Minh,,Khác,0
2917,NhatNam,CTCP Nhất Nam,,OTC,0
2918,NHDulieu,Công ty TNHH Ngân hàng Dữ liệu,,Khác,0
2919,NHHC,CTCP Đầu tư và Xây dựng Thủy điện Nậm Hồng,,Khác,0
2920,NhietDienMienBac,CTCP Dịch vụ Sửa chữa Nhiệt điện Miền Bắc,,OTC,0
2921,NHN,CTCP Phát triển Đô thị Nam Hà Nội,Phát triển và quản lý bất động sản,OTC,200000000
2922,NhoQue1,CTCP Thủy điện Nho Quế 1,,OTC,0
2923,NHPC,CTCP Bất động sản Ngôi nhà Hạnh phúc,,Khác,0
2924,NHRC,CTCP Nova Hotels & Resorts,,Khác,0
2925,NHS,CTCP Đường Ninh Hòa,"Thực phẩm, đồ uống và thuốc lá",OTC,60750000
2926,NHSC,Công ty TNHH MTV Đường Biên Hòa - Ninh Hòa,,Khác,0
2927,NHSV,Công ty TNHH Chứng khoán NH Việt Nam,Dịch vụ tài chính,Khác,0
2928,NhuNgoc,CTCP Sản xuất và Thương mại Xuất nhập khẩu Như Ngọc,,OTC,0
2929,NHW,CTCP Ngô Han,Tư liệu sản xuất,OTC,22950627
2930,NIC,CTCP Đầu tư Nhơn Trạch,,OTC,0
2931,Nicotex,CTCP Nicotex,,Khác,0
2932,NinhBac,CTCP Đầu tư Tài chính Ninh Bắc,,OTC,0
2933,NIS,CTCP Dịch vụ Hạ tầng Mạng,Dịch vụ viễn thông,OTC,3000000
2934,NISACO,CTCP Muối Ninh Thuận,,OTC,0
