STT,Mã CK▲,Tên công ty,Ngành,Sàn,Khối lượng NY/ĐKGD
1778,BecamexCMC,CTCP Vật liệu Xây dựng Becamex,,OTC,0
1779,BenhVienGiaoThong,CTCP Bệnh viện Giao thông Vận tải,,OTC,0
1780,BenThanhG,Tổng Công ty Bến Thành,,OTC,0
1781,Benthanhhouse,CTCP Phát triển và Dịch vụ Nhà Bến Thành,,OTC,0
1782,Beta,CTCP Chứng khoán Beta,Dịch vụ tài chính,OTC,40000000
1783,BeTongHaiAu,CTCP Bê tông Hải Âu,,OTC,0
1784,BGDC,CTCP Phát triển Đầu Tư - Xây dựng Bách Giang - DCI,,Khác,0
1785,BGIC,Công ty TNHH Đầu tư Big Gain,,Khác,0
1786,BGM,CTCP Khai Thác và Chế Biến khoáng Sản Bắc Giang,Nguyên vật liệu,OTC,45753840
1787,BHAAC,Công ty TNHH Kiểm toán và Kế toán Biên Hoà,,Khác,0
1788,BHBC,CTCP Năng lượng Bắc Hà,,Khác,0
1789,BHCC,CTCP Bình Hiệp,,Khác,0
1790,BHDienMay,CTCP Bách hóa Điện máy Sài Gòn,,OTC,0
1791,BHGC,CTCP Đầu tư và Phát triển golf Bình Hải,,Khác,0
1792,BHS,Công ty TNHH MTV Đường TTC Biên Hòa - Đồng Nai,"Thực phẩm, đồ uống và thuốc lá",Khác,297874449
1793,BHSC,CTCP Hàng tiêu dùng Biên Hòa,,Khác,0
1794,BHT,CTCP Đầu tư Xây dựng Bạch Đằng TMC,Tư liệu sản xuất,OTC,4565000
1795,BHV,CTCP Bá Hiến,Nguyên vật liệu,OTC,972013
1796,BHVC,CTCP Bách Hưng Vương,,Khác,0
1797,BHYC,Công ty TNHH Dịch vụ và Phát triển Bất động sản BHYT,,Khác,0
1798,BIAC,CTCP Đầu Tư và Phát triển Bất động sản Bình An,,Khác,0
1799,BiaCanTho,CTCP Bia Nước giải khát Cần Thơ,,OTC,2390000
1800,BiaSaiGonDongNai,CTCP Bia Sài Gòn - Đồng Nai,,OTC,0
1801,BiaSaiGonHaNam,CTCP Bia Sài Gòn - Hà Nam,,OTC,0
1802,BiaSaiGonPhuYen,CTCP Bia Sài Gòn - Phú Yên,,OTC,6000000
1803,BiaSaiGonQuyNhon,CTCP Bia Sài Gòn - Quy Nhơn,,OTC,0
1804,BiaVietHa,CTCP Bia và Nước giải khát Việt Hà,,OTC,0
1805,BIDC,CTCP BIDGroup,,Khác,0
1806,BIDVMetlife,Công ty TNHH Bảo hiểm nhân thọ BIDV Metlife,Bảo hiểm,Khác,0
1807,BIMC,CTCP Bất động sản BIM,,Khác,0
1808,BinhAnSeaFood,CTCP Thủy sản Bình An,,OTC,50000000
1809,BinhDien,CTCP Thủy điện Bình Điền,,OTC,0
1810,BinhDinh,CTCP Vật tư Kỹ thuật Nông nghiệp Bình Định,,OTC,0
1811,BinhTriThien,CTCP Lương thực Bình Trị Thiên,,OTC,0
1812,Biprica,CTCP In và Bao bì Bình Định,,OTC,0
1813,BITC,CTCP Kinh doanh và Đầu Tư Bình Dương,,Khác,0
1814,BIZC,CTCP Khu công nghiệp Thành Thành Công,,Khác,0
1815,BJC,CTCP VRG - Bảo Lộc,,OTC,0
1816,BJCC,CTCP Đầu Tư Thương Mại Bright Jupiter,,Khác,0
1817,BKH,CTCP Bánh mứt kẹo Hà Nội,"Thực phẩm, đồ uống và thuốc lá",OTC,1750000
1818,BKPC,CTCP Phần mềm diệt virus Bkav,,Khác,0
1819,BLU,Trung tâm Dịch vụ Đô thị tỉnh Bạc Liêu,Dịch vụ chuyên biệt và thương mại,OTC,1337600
1820,Bluechipfund,Quỹ đầu tư Cổ phiếu Hàng đầu VCBF,,OTC,0
1821,BLW,CTCP Cấp nước Bạc Liêu,Dịch vụ tiện ích,OTC,11168800
1822,BM9,CTCP Đầu tư Xây dựng 319 Miền Nam,Phân phối và bán lẻ hàng lâu bền,OTC,3795680
1823,BMJC,CTCP Xây dựng và Sản xuất Vật liệu Xây dựng,,OTC,0
1824,BNC,CTCP Dịch vụ Cáp treo Bà Nà,,OTC,216400000
1825,BNPC,CTCP Bất động sản BNP Global,,Khác,0
1826,BongSen,CTCP Bông Sen,,OTC,32663788
1827,BOOC,CTCP B.O.O Nước Thủ Đức,,Khác,0
1828,BOT741,CTCP Kinh doanh BOT đường ĐT.741,,Khác,0
1829,BOTRM,Công ty TNHH B.O.T Cầu Rạch Miễu,,Khác,0
1830,BPCC,CTCP Năng lượng Bitexco,,Khác,0
1831,BPEC,CTCP Năng lượng Bắc Phương,,Khác,0
1832,BPGC,CTCP Điện gió Bắc Phương,,Khác,0
1833,BPMC,CTCP Vật tư Xăng dầu Bình Thuận,,OTC,0
1834,BPW,CTCP Cấp thoát nước Bình Phước,Dịch vụ tiện ích,OTC,13203858
1835,Britec,CTCP Tư vấn Thiết kế Cầu Lớn - Hầm,,OTC,0
1836,BSMCorp,CTCP Phần mềm Giải pháp Quản lý Mã vạch,,OTC,0
1837,BSPC,CTCP BB Sunrise Power,,Khác,0
1838,BTC,CTCP Cơ khí và Xây dựng Bình Triệu,Tư liệu sản xuất,OTC,30000000
1839,BTCC,CTCP Tân Hoàn Cầu Bến Tre,,Khác,0
1840,BTCom,CTCP Đầu tư Thương mại Bến Thành,,OTC,0
1841,BTIC,CTCP Đầu Tư Thương Mại Bình Tân,,Khác,0
1842,BTJ,CTCP Vàng bạc Đá quý Bến Thành,,OTC,0
1843,BTL,CTCP Tập đoàn Capella,,OTC,13625400
1844,BTR,CTCP Đường sắt Bình Trị Thiên,Vận tải,OTC,1850000
1845,BTWASECO,CTCP Cấp thoát nước Bình Thuận,,OTC,0
1846,BUD,CTCP Khoa học Công nghệ Việt Nam,Dịch vụ chuyên biệt và thương mại,OTC,10000000
1847,BuuDienCM,CTCP Xây lắp và Dịch vụ Bưu điện Cà Mau,,OTC,0
1848,BVA,CTCP Sản xuất và Thương mại Bắc Việt,,OTC,0
1849,BVBC,CTCP BVB,,Khác,0
1850,BVC,CTCP Nhựa Bảo Vân,,OTC,24000000
1851,BVF1,Quỹ đầu tư Chứng khoán Bảo Việt,,Khác,0
1852,BVFED,Quỹ đầu tư Cổ phiếu Năng động Bảo Việt,,OTC,0
1853,BVFMC,Công ty TNHH Quản lý Quỹ Bảo Việt,,Khác,0
1854,BVIM,CTCP Quản lý Quỹ BVIM,,Khác,0
1855,BVMC,CTCP Đầu Tư Bệnh viện Việt Mỹ,,Khác,0
1856,BXBTQuangNinh,Công ty TNHH MTV Bến Xe - Bến Tàu Quảng Ninh,,Khác,0
1857,BXD,CTCP Vận tải và Quản lý Bến xe Đà Nẵng,Vận tải,OTC,1736500
1858,BXT,CTCP Bến xe Tàu Hậu Giang,Vận tải,OTC,63400
1859,C36,CTCP Quản lý và Xây dựng Công trình Giao thông 236,Tư liệu sản xuất,OTC,1123500
1860,C42,CTCP Xây dựng Thủy lợi 42,,OTC,0
1861,C71,CTCP 471,Tư liệu sản xuất,OTC,5000000
1862,CAA,Công ty TNHH Tư vấn và Kiểm toán CA&A,,Khác,0
1863,CAB,CTCP Tổng Công ty Truyền hình Cáp Việt Nam,Truyền thông và giải trí,OTC,45745876
1864,CADICO,CTCP Cadico,,OTC,0
1865,Cafatex,CTCP Thủy sản Cafatex,,OTC,0
1866,CafeControl,CTCP Giám định Cà phê và Hàng Hoá Xuất nhập khẩu,,OTC,1700000
1867,CAGLOBAL,Công ty TNHH Kiểm toán và Tư vấn Toàn cầu,,Khác,0
1868,CAM,CTCP Môi trường đô thị Cà Mau,Dịch vụ tiện ích,OTC,1310700
1869,CamRanh,CTCP Thương mại Hàng không Cam Ranh,,OTC,0
1870,CangVatCach,CTCP Cảng Vật Cách,,OTC,0
1871,CanHoNamLong,CTCP Phát triển Căn hộ Nam Long,,OTC,0
1872,CanhXuanAudit,Công ty TNHH Kiểm toán Cảnh Xuân,,Khác,0
1873,CaoSuBinhDuong,CTCP Cao su Bình Dương,,OTC,0
1874,CAPHEDALAT,Công ty TNHH MTV Xuất nhập khẩu Cà phê Đà Lạt,,Khác,0
1875,CapitaLand,Công ty TNHH Quản lý Bất động sản CapitalLand,,Khác,0
1876,CapNuocCanTho2,CTCP Cấp nước Cần Thơ II,,OTC,0
1877,CapNuocNghiaLo,Công ty TNHH Xây dựng Cấp thoát nước Nghĩa Lộ,,Khác,0
1878,CapNuocYenBai,Công ty TNHH MTV Cấp nước Yên Bái,,Khác,0
1879,CapQuang,CTCP Công nghệ Cáp quang và Thiết bị Bưu điện,,OTC,0
1880,CapVietNhat,CTCP Đầu tư Thương mại Việt Nhật,,OTC,10000000
1881,Caric,CTCP Caric,,OTC,0
1882,CASHIN,CTCP Công nghiệp Tàu thủy và Vận tải Cần Thơ,,OTC,4732985
1883,CASOCO,CTCP Cảng Phú Định,,OTC,0
1884,CathayLife,Công ty TNHH Bảo hiểm Nhân thọ Cathay - Việt Nam,Bảo hiểm,Khác,0
1885,CatTuongAudit,Công ty Kiểm toán Cát Tường VAI,,Khác,0
1886,Cau14,CTCP Cầu 14 - Cienco 1,,OTC,0
1887,CauGiay,CTCP Đầu tư Thương mại Dịch vụ Cầu Giấy,,OTC,7670000
1888,CauTre,CTCP Thực phẩm CJ Cầu Tre,,OTC,11700000
1889,CAV,CTCP Dây Cáp điện Việt Nam,Tư liệu sản xuất,OTC,57600000
1890,Cavicob,CTCP Cavico Xây dựng Cầu Hầm,,OTC,7000000
1891,CavicoEc,CTCP Xây dựng Năng lượng,,OTC,3250000
1892,CavicoGiaoThong,CTCP CAVICO Giao thông,,OTC,0
1893,CavicoHaTang,CTCP Cavico Xây dựng Hạ tầng,,OTC,0
1894,CavicoHC,CTCP Cavico Xây dựng Thủy điện,,OTC,6455103
1895,CavicoVN,CTCP Xây dựng và Đầu Tư Cavico Việt Nam,,OTC,0
1896,CayTrong,CTCP Giống cây trồng Quảng Ninh,,OTC,0
1897,CBC,CTCP Chè Bàu Cạn,"Thực phẩm, đồ uống và thuốc lá",OTC,11882400
1898,CBEC,Công ty TNHH Du lịch sinh thái Cồn Bắp,,Khác,0
1899,CBGC,CTCP Crystal Bay,,Khác,0
1900,CBSC,Công ty TNHH Mặt trời Cát Bà,,Khác,0
1901,CBV,CTCP CTCBIO Việt Nam,,Khác,0
1902,CC7,CTCP Xây dựng Công trình Giao thông 710,,OTC,3167323
1903,CCH,CTCP Tư vấn và Đầu tư Xây dựng CCIC Hà Nội,Dịch vụ chuyên biệt và thương mại,OTC,1000000
1904,CCIC,CTCP Đầu tư Con Cưng,,Khác,0
1905,CCN2,CTCP Xây dựng Số 2 Quảng Ninh,,OTC,0
1906,CDMC,CTCP Đường Man,,Khác,0
1907,CE1,CTCP Xây dựng và Thiết bị Công nghiệp CIE1,Tư liệu sản xuất,OTC,6000000
1908,CEC,CTCP Thiết kế Công Nghiệp Hóa chất,Dịch vụ chuyên biệt và thương mại,OTC,5977036
1909,CEE,CTCP Xây dựng Hạ tầng CII,Tư liệu sản xuất,OTC,41500000
1910,CEG,CTCP Tập đoàn Xây dựng và Thiết bị Công nghiệp,Tư liệu sản xuất,OTC,3800000
1911,CemacoHanoi,CTCP Hóa chất và Vật tư Khoa học Kỹ thuật,,OTC,0
1912,CENC,Công ty TNHH Đầu tư Central Capital,,Khác,0
1913,CER,CTCP Địa chính và Tài nguyên Môi trường,Dịch vụ chuyên biệt và thương mại,OTC,1335000
1914,CFC,CTCP Cafico Việt Nam,"Thực phẩm, đồ uống và thuốc lá",OTC,2234280
1915,CFCC,Công ty xi măng CHINFON,,Khác,0
1916,CGGC,CTCP Đầu tư Thương mại và Dịch vụ Việt Mỹ A&V,,Khác,0
1917,CGL,CTCP Thương mại Gia Lai,Phân phối và bán lẻ hàng lâu bền,OTC,1880000
1918,CGP,CTCP Dược phẩm Cần Giờ,"Dược phẩm, Công nghệ sinh học và Khoa học thường thức",Khác,10735708
1919,CGRC,CTCP City Garden,,Khác,0
1920,CHAC,CTCP Thương mại Du lịch Đầu tư Cù Lao Chàm,,Khác,0
1921,CHDC,CTCP Hải Đăng,,Khác,0
1922,CheBienLamSan,Công ty Vận tải và Chế biến Lâm sản,,Khác,0
1923,CheBienThucPham,Xí Nghiệp Kinh doanh Gia súc Gia cầm và Chế biến Thực phẩm,,Khác,0
1924,CheLamDong,CTCP Chè Lâm Đồng,,OTC,0
1925,CHIN2,CTCP Chín Chín Núi,,OTC,0
1926,ChipSang,CTCP Chíp Sáng,,OTC,0
1927,ChoLonTourist,CTCP Dịch vụ Du lịch Chợ lớn,,OTC,0
1928,ChuanVang,Công ty TNHH Kiểm toán Chuẩn Vàng,,Khác,0
1929,CHUBBLIFE,Công ty TNHH MTV Quản lý Quỹ CHUBB LIFE,,Khác,0
1930,ChubbLifeVN,Công ty TNHH Bảo hiểm nhân thọ Chubb Việt Nam,Bảo hiểm,Khác,0
1931,CHULAIQN,CTCP Đầu tư và Phát triển Kỳ Hà - Chu Lai Quảng Nam,,OTC,0
1932,CIC,CTCP Đầu tư và Xây dựng Cotec,Tư liệu sản xuất,OTC,4635062
1933,CIC1,CTCP Xây dựng Dân dụng Công nghiệp Số 1 - Đồng Nai,,OTC,1537200
1934,CIC8,CTCP Đầu tư và Xây dựng Số 8,,OTC,400000
1935,CICP1,CTCP Tư vấn Đầu tư và Xây dựng Công trình 1,,OTC,0
1936,CIE,CTCP Đầu tư và Xây dựng Công trình 128,,OTC,0
1937,CIENCO1,Tổng Công ty Xây dựng Công trình Giao thông 1 - CTCP,,OTC,0
1938,CIENCO473,CTCP 473,,OTC,2000000
1939,CIENCO5,Tổng Công ty Xây dựng Công trình Giao thông 5 - CTCP,,OTC,0
1940,CIENCO503,CTCP Xây dựng Giao thông 503,,OTC,0
1941,CIENCO610,CTCP Xây dựng Công trình Giao thông 610,,OTC,2686300
1942,CIENCO624,CTCP Vật tư Thiết bị và Xây dựng Công trình 624,,OTC,0
1943,CIENCO8,Tổng Công ty Xây dựng Công trình Giao thông 8 - CTCP,,Khác,0
1944,Ciencoland,CTCP Đầu tư Xây dựng và Kinh doanh Bất động sản Tổng Sáu,,OTC,0
1945,CIMB,Công ty TNHH Chứng khoán CIMB-VINASHIN,Dịch vụ tài chính,Khác,33334000
1946,Cistra,CTCP Dịch vụ Thương mại Thành Phố,,OTC,0
1947,CIV,CTCP Đầu tư Vinamotor,,OTC,3155930
1948,CIVC,CTCP Đầu tư và Phát triển Bất động sản Thế Kỷ,,Khác,0
1949,CJC203,CTCP Xây dựng 203,,OTC,0
1950,CKH,CTCP Cơ khí Chế Tạo Hải Phòng,Tư liệu sản xuất,OTC,1037626
1951,CKI,CTCP Cơ khí ngành In,,OTC,0
1952,CKTAYNINH,CTCP Cơ khí Tây Ninh,,OTC,0
1953,CLAC,Công ty TNHH Đầu tư Cam Lâm,,Khác,0
1954,CLHC,Công ty TNHH Phát triển Bất động sản Cát Liên Hoa,,Khác,0
1955,CLP,CTCP Thủy sản Cửu Long,"Thực phẩm, đồ uống và thuốc lá",OTC,8000000
1956,CLRC,CTCP Đầu Tư Công nghệ Smarttech,,Khác,0
1957,CLS,CTCP Chứng khoán Chợ Lớn,Dịch vụ tài chính,Khác,0
1958,CLWC,CTCP Phong điện Chơ Long,,Khác,0
1959,CMCHanoi,CTCP Vật liệu Xây dựng Hà Nội,,OTC,0
1960,CMHC,CTCP Cổng Mây,,Khác,0
1961,CMIBBank,Ngân hàng TNHH MTV CIMB Việt Nam,,Khác,0
1962,CNCC,CTCP Thương mại - Dịch vụ Công nghệ cao,,Khác,0
1963,CNH,CTCP Cảng Nha Trang,Vận tải,OTC,24539049
1964,CNTC,CTCP Công nghiệp Năng lượng Ninh Thuận,,Khác,0
1965,CO122,CTCP Xây dựng và Đầu tư 122 - Cienco 1,,OTC,0
1966,CoKhiDuyenHai,Công ty TNHH Nhà nước MTV Cơ khí Duyên Hải,,Khác,0
1967,CoKhiHonGai,CTCP Cơ khí Hòn Gai - Vinacomin,,OTC,0
1968,CokhiNgoGiaTu,CTCP Cơ khí Ngô Gia Tự,,OTC,0
1969,CoKhiOTo32,CTCP Cơ khí Ô Tô 3-2,,OTC,0
1970,Colombo,Công ty TNHH Đầu tư và Phát triển Colombo,,Khác,0
1971,COMPT,"Công ty TNHH Tư vấn Đầu tư, Tài chính, Kế toán Thuế - Kiểm toán COM.PT",,Khác,0
1972,ConDao,CTCP Thủy sản và Xuất nhập khẩu Côn Đảo,,OTC,0
1973,CongNgheCao,CTCP Công nghệ Cao,,OTC,0
1974,CongNghiepMasan,CTCP Công nghiệp Masan,,OTC,0
1975,CongNghiepPhuYen,CTCP Công nghiệp Phú Yên,,OTC,0
1976,CongThanh,CTCP Xi măng Công Thanh,,OTC,0
1977,CongTrinh134,CTCP Đầu tư và Xây dựng Công trình 134,,OTC,0
1978,CongTrinh525,CTCP Xây dựng Công trình 525,,OTC,3130000
1979,CongTrinhBuuDien,CTCP Phát triển Công trình Bưu điện,,OTC,0
1980,CongTrinhGTDB,CTCP Công trình Giao thông Tỉnh Điện Biên,,OTC,0
1981,CongTrinhHaNoi,CTCP Đầu Tư Công trình Hà Nội,,OTC,0
1982,CongTy118,CTCP 118,,OTC,0
1983,CONSTRAD423,CTCP Xây dựng và Thương mại 423,,OTC,1250000
1984,CoopBank,Ngân hàng Hợp tác xã Việt Nam,Tổ chức tín dụng,Khác,0
1985,COPAC,CTCP Đầu Tư Xây dựng và Thương mại Thái Bình Dương,,OTC,9700000
1986,Coresco,CTCP Đầu Tư Xây dựng Kinh doanh Nhà Bến Thành,,OTC,2600000
1987,Cosaco,CTCP Sài Gòn Xây dựng,,OTC,0
1988,Cosevco1,CTCP Sản xuất Vật liệu và Xây dựng Cosevco 1,,OTC,0
1989,Cosevco75,CTCP Cosevco 75,,OTC,0
1990,COT60,CTCP Công trình Giao thông 60,,OTC,0
1991,Cotec,CTCP Kỹ thuật Xây dựng và Vật liệu Xây dựng COTEC,,OTC,0
1992,CotecAnpha,CTCP Kỹ thuật Xây dựng Anpha,,OTC,0
1993,COXANO,CTCP Cơ khí Xây dựng Công trình Thừa Thiên Huế,,OTC,1556240
1994,CPAHaNoi,Công ty Kiểm toán và Kế toán Hà Nội,,Khác,0
1995,CPAHCM,Công ty TNHH Kiểm toán và Tư vấn CPA HCM,,Khác,0
1996,CPAVietNam,Công ty Hợp danh Kiểm toán Việt Nam,,Khác,0
1997,CPGC,CTCP Tập đoàn Casper Việt Nam,,Khác,0
1998,CPHACO,CTCP Đầu tư Xây dựng Chánh Phú Hòa,,Khác,0
1999,CPLC,Công ty TNHH Capitaland Tower,,Khác,0
2000,CPSC,Công ty TNHH Mặt trời Cẩm Phả,,Khác,0
2001,CPT,CTCP Xây lắp Bưu điện,,OTC,0
2002,CPTC,CTCP Đầu Tư và Xây dựng Giao thông Vận tải,,Khác,0
2003,CPW,CTCP Công trình Giao thông Công chánh,Tư liệu sản xuất,OTC,26875000
2004,CQNC,CTCP Capella Quảng Nam,,Khác,0
2005,CRV,CTCP Tập đoàn Bất động sản CRV,,Khác,0
2006,CSCJ,CTCP Chứng khoán Thủ Đô,Dịch vụ tài chính,OTC,7573667
2007,CSG,CTCP Cáp Sài Gòn,Dịch vụ viễn thông,Khác,29742020
2008,CSLC,CTCP Hải Phát Retail,,Khác,0
2009,CST124,CTCP Xây dựng Giao thông và Thương mại 124,,OTC,0
2010,CT185,CTCP Trường Sơn 185,,Khác,0
2011,CT5,CTCP 319.5,Tư liệu sản xuất,OTC,4400000
2012,CTAC,CTCP Du lịch và Đầu Tư Xây dựng Châu Á,,Khác,0
2013,CTC,CTCP Tập đoàn Hoàng Kim Tây Nguyên,Dịch vụ tiêu dùng,OTC,15799926
2014,CTCCorp,CTCP Đô thị Du lịch Cần Giờ,,OTC,0
2015,CTE,CTCP Hạ Tầng Viễn Thông CMC,,OTC,0
2016,CTEC,CTCP Xây dựng và Trang trí Nội thất Cát Tường,,Khác,0
2017,CTGT,CTCP Công trình Giao thông Tỉnh Bà Rịa - Vũng Tàu,,OTC,6000000
2018,CTLC,Công ty TNHH CITYLAB,,Khác,0
2019,CTM,CTCP Đầu tư Xây dựng và Khai thác mỏ Vinavico,Tư liệu sản xuất,OTC,4399996
2020,CTRC,Công ty TNHH Đầu tư Cao su Cường Thịnh,,Khác,0
2021,CTV,CTCP Đầu tư - Sản xuất và Thương mại Việt Nam,Phân phối và bán lẻ hàng lâu bền,OTC,2000000
2022,CTVC,Tập đoàn Cá tầm Việt Nam,,Khác,0
2023,Cty479,CTCP 479,,OTC,0
2024,CTYCN2,Công ty TNHH MTV Cấp nước số 2,,Khác,0
2025,CVC,CTCP Cơ điện Vật tư,Tư liệu sản xuất,OTC,2200000
2026,CVDC,CTCP Đầu tư và Phát triển Du lịch Vân Đồn,,Khác,0
2027,CVH,"CTCP Công viên, Cây xanh Hải Phòng",Dịch vụ chuyên biệt và thương mại,OTC,1280000
2028,CVP,CTCP Cảng Cửa Việt,Vận tải,OTC,3425980
2029,CVS,CTCP Chứng khoán CV,Dịch vụ tài chính,OTC,0
2030,CVSC,CTCP CVS Holding,,Khác,0
2031,CXC,CTCP Cầu Xây,,OTC,0
2032,CXH,CTCP Xe khách Hà Nội,Vận tải,OTC,1885306
2033,CZC,CTCP Than Miền Trung,Năng lượng,OTC,5602590
2034,D17,CTCP Đồng Tân,Nguyên vật liệu,OTC,5259700
2035,D26,CTCP Quản lý và Xây dựng Đường bộ 26,Tư liệu sản xuất,OTC,1000000
2036,DAB,Ngân hàng TMCP Đại Á,Tổ chức tín dụng,Khác,310000000
2037,DaBinhDinh,CTCP VRG Đá Bình Định,,OTC,0
2038,DAFC,CTCP Thời trang và Mỹ phẩm Duy Anh,,Khác,0
2039,DaGiayHaiPhong,CTCP Da Giầy và Phát triển Hải Phòng,,OTC,0
2040,DaGiayVietNam,CTCP Da Giầy Việt Nam,,OTC,0
2041,DaichiLife,Công ty TNHH Bảo hiểm Nhân thọ Dai-ichi Việt Nam,Bảo hiểm,Khác,0
2042,DaiMo,CTCP Cơ khí Xây dựng Đại Mỗ,,OTC,0
2043,DaiNam,Văn Phòng Thám Tử Điều Tra - Theo Dõi Đại Nam,,Khác,0
2044,DaiNamAudit,Công ty TNHH Kiểm toán và Giải pháp Công nghệ Thông tin Đại Nam,,Khác,0
2045,DaiTinAudit,Công ty TNHH Kiểm toán Đại Tín,,Khác,0
2046,DAKC,Công ty Liên doanh TNHH Phát triển Đô thị mới An Khánh,,Khác,0
2047,DALC,Công ty TNHH Đầu tư và Phát triển Bất động sản Đại Hùng,,Khác,0
2048,DaNangXD,CTCP Xây dựng Công trình Giao thông Đà Nẵng,,OTC,0
2049,DANATEX,CTCP Dệt Hòa Khánh - Đà Nẵng,,OTC,0
2050,DAP,CTCP Đông Á,Nguyên vật liệu,OTC,1680000
2051,DAR,CTCP Xe lửa Dĩ An,Dịch vụ chuyên biệt và thương mại,OTC,6500000
2052,DaTayDo,CTCP Da Tây Đô,,OTC,0
2053,DATC,Công ty TNHH Mua Bán Nợ Việt Nam,,Khác,0
2054,DatVang,CTCP Sông Đà - Đất Vàng,,OTC,0
2055,DauTuHaNoi,CTCP Thương mại và Đầu tư TIC Hà Nội,,OTC,0
2056,DBCC,Tổng công ty Đông Bắc - Bộ Quốc Phòng,,Khác,0
2057,DBF,CTCP Lương thực Đông Bắc,Bán lẻ thực phẩm và nhu yếu phẩm,OTC,3679200
2058,DBH,CTCP Đường bộ Hải Phòng,Tư liệu sản xuất,OTC,2200000
2059,DBIC,Công ty TNHH MTV Đầu tư và Phát triển DB,,Khác,0
2060,DBJC,CTCP Điện Biên,,Khác,0
2061,DBW,CTCP Cấp nước Điện Biên,Dịch vụ tiện ích,OTC,39320100
2062,DCAC,CTCP Tập đoàn Đèo Cả,,Khác,0
2063,DCC,CTCP Xây dựng Công nghiệp (DESCON),Tư liệu sản xuất,OTC,10300000
2064,DCCC,CTCP Địa Cầu,,Khác,0
2065,DCD,CTCP Du lịch và Thương mại DIC,Dịch vụ tiêu dùng,Khác,11294323
2066,DCHY,Công ty TNHH Đầu tư Dream City Villas Hưng Yên,,Khác,0
2067,DCI,CTCP Công nghiệp Hóa chất Đà Nẵng,Nguyên vật liệu,OTC,2412518
2068,DCPA,Công ty TNHH Tư vấn DCPA,,Khác,0
2069,DCTC,Công ty TNHH DCT Partners Việt Nam,,Khác,0
2070,DDCC,CTCP Đầu tư Bất động sản Đông Dương,,Khác,0
2071,DDS,CTCP Chứng khoán AIS,Dịch vụ tài chính,OTC,3000000
2072,Deloitte,Công ty TNHH Deloitte Việt Nam,,Khác,0
2073,DeltaAgf,CTCP Đầu tư và Xây dựng Delta AGF,,OTC,5691644
2074,DeltaCorp,CTCP Đầu tư Châu Thổ,,OTC,0
2075,DeltaTower,CTCP Cảnh Hưng Hải Thành,,OTC,24000000
2076,DetHaDong,CTCP Dệt Hà Đông,,OTC,1300000
2077,DetPhongPhu,CTCP Dệt vải Phong Phú,,OTC,0
2078,DetVinhPhu,CTCP Dệt Vĩnh Phú,,OTC,0
2079,DeutscheBank,Ngân hàng Deutsche Việt Nam,Tổ chức tín dụng,Khác,0
2080,DFK,Công ty TNHH Kiểm toán DFK Việt Nam,,Khác,0
2081,DFS,CTCP Chế biến Xuất nhập khẩu Nông sản Thực phẩm Đồng Nai,"Thực phẩm, đồ uống và thuốc lá",OTC,22500000
2082,DFVN,Công ty TNHH MTV Quản lý Quỹ Dai-Ichi Life Việt Nam,,Khác,0
2083,DGL,CTCP Hóa chất Đức Giang - Lào Cai,Nguyên vật liệu,Khác,99785463
2084,DHAC,Công ty TNHH MTV Đầu tư DHA,,Khác,0
2085,DHCC,CTCP Thủy điện Đakđrinh,,Khác,0
2086,DHI,CTCP In Diên Hồng,Dịch vụ chuyên biệt và thương mại,Khác,2628042
2087,DHL,CTCP Cơ khí Vận tải Thương mại Đại Hưng,Nguyên vật liệu,Khác,5500000
2088,DIAOC3,CTCP Xây dựng và Kinh doanh Địa Ốc III,,OTC,0
2089,DIAOC8,CTCP Địa ốc 8,,Khác,0
2090,DiaOcGiaDinh,CTCP Đầu tư Địa ốc Gia Định,,OTC,0
2091,DiaOcXanh,Công ty TNHH Đầu tư Kinh doanh và Phát triển Thương mại Địa Ốc Xanh,,Khác,0
2092,DIC1,CTCP Xây dựng Đô thị và Khu công nghiệp,,OTC,2000000
2093,DICC,Công ty TNHH Dynamic Innovation,,Khác,0
2094,DICThanhBinh,CTCP Đầu tư Phát triển Xây dựng Thanh Bình,,OTC,500000
2095,DienLucDaNang,CTCP Thủy điện Điện Lực Đà Nẵng,,OTC,0
2096,DienNuocHaNoi,CTCP Xây dựng Lắp máy Điện nước Hà Nội,,OTC,0
2097,DienThuBon,CTCP Thủy điện Thu Bồn,,OTC,0
2098,Diginet,CTCP Định Gia Nét,,OTC,1500000
2099,DinhThien,Công Ty TNHH Thương mại Dịch vụ Kỹ thuật Đỉnh Thiên,,Khác,0
2100,DJCC,CTCP Thủy điện Đakrông,,Khác,0
2101,DKDC,Công ty TNHH Du lịch Khách sạn Đông Á,,Khác,0
2102,DKH,Trung tâm Đăng kiểm phương tiện Giao thông Thủy bộ,Dịch vụ chuyên biệt và thương mại,OTC,212036
2103,DKHC,CTCP Đầu tư Danh khôi Holdings,,Khác,0
2104,DKKC,CTCP Tập đoàn Dekko,,Khác,0
2105,DKP,CTCP Dược Khoa,"Dược phẩm, Công nghệ sinh học và Khoa học thường thức",OTC,3003910
2106,DKSC,CTCP Đầu tư Bất động sản Danh Khôi Sài Gòn,,Khác,0
2107,DLAC,CTCP Đầu tư và Xây dựng Kiên Trung,,Khác,0
2108,DLBD,CTCP Du lịch Bưu điện,,OTC,0
2109,DLC,CTCP Du lịch Cần Thơ,Dịch vụ tiêu dùng,OTC,4780080
2110,DLCC,Công ty TNHH Đầu tư và Phát triển Đô thị Đắk Lắk,,Khác,0
2111,DLM,CTCP Chiếu sáng công cộng Đà Nẵng,Tư liệu sản xuất,OTC,1160250
2112,DLTC,CTCP Du Lịch Lâm Đồng,,Khác,0
2113,DLTHUDUC,Công ty TNHH MTV Dịch vụ Du lịch Thủ Đức,,Khác,0
2114,DLV,CTCP Du lịch Việt Nam - VITOURS,Dịch vụ tiêu dùng,OTC,0
2115,DLVC,Công ty TNHH Bất động sản Đà Lạt Valley,,Khác,0
2116,DLX,CTCP Delex Việt Nam,,OTC,0
2117,DMDC,CTCP Quản lý Tài sản Pyxis,,Khác,0
2118,DMH,CTCP Dược Minh Hải,,OTC,2500000
2119,DMIC,Công ty TNHH Đầu tư Xuất nhập khẩu Tổng hợp Đức Mai,,Khác,0
2120,DMTC,CTCP Khoan và Dịch vụ Kỹ thuật Khai thác Mỏ,,OTC,0
2121,DNB,CTCP Sách và Thiết bị trường học tỉnh Đắk Nông,Phân phối và bán lẻ hàng lâu bền,OTC,1447554
2122,DNCC,CTCP Đại Nam,,Khác,0
2123,DNF,CTCP Lương thực Đà Nẵng,"Thực phẩm, đồ uống và thuốc lá",OTC,5000000
2124,DNG,CTCP Lắp máy Điện nước và Xây dựng,,OTC,0
2125,DNPAudit,Công ty TNHH Kiểm toán - Tư vấn Tài chính D.N.P,,Khác,0
2126,DNR,CTCP Đường sắt Quảng Nam - Đà Nẵng,Vận tải,OTC,1577500
2127,DNS,CTCP Thép Đà Nẵng,Nguyên vật liệu,OTC,21600000
2128,DNTD,CTCP Thiết kế Viễn thông Tin học Đà Nẵng,,OTC,0
2129,DNV,CTCP Thương mại Dịch vụ VDA Đà Nẵng,,OTC,8100000
2130,DNY,CTCP Thép DANA - Ý,Nguyên vật liệu,OTC,26999517
2131,Donatraco,CTCP Sản xuất Thương mại Dịch vụ Đồng Nai,,OTC,0
2132,DongACapital,Công ty TNHH Quản lý Quỹ đầu tư Chứng khoán Đông Á,,Khác,0
2133,DongAnhSteel,CTCP Kết cấu Thép Xây dựng,,OTC,0
2134,DongASecurities,Công ty TNHH MTV Chứng khoán Ngân hàng Đông Á,Dịch vụ tài chính,Khác,50000000
2135,DongDuong,Công ty TNHH Kiểm toán Đông Dương,,Khác,0
2136,DongLong,Công ty TNHH Vận tải biển Đông Long,,Khác,0
2137,DongNam,Công ty TNHH Kiểm toán Đông Nam,,Khác,0
2138,DongPhuongAudit,Công ty TNHH Tư vấn Tài chính và Kiểm toán Đông Phương,,Khác,0
2139,DongTam,CTCP Đồng Tâm,,OTC,0
2140,DongTauAnPhu,CTCP Đóng Tàu An Phú,,OTC,0
2141,DongThang,Công ty TNHH Kiểm toán Đồng Thắng,,Khác,0
2142,DongThapTourist,CTCP Du lịch Đồng Tháp,,OTC,0
2143,DongTien,CTCP Đồng Tiến,,OTC,0
2144,DongXanh,CTCP Đồng Xanh,,OTC,0
2145,DoThi18,CTCP Đầu tư Hạ tầng 18,,OTC,0
2146,DothiGialai,CTCP Công trình Đô thị Gia Lai,,OTC,0
2147,DoThiGiaLam,CTCP Môi trường Đô thị Gia Lâm,,Khác,0
2148,DPD,CTCP Cao su Đồng Phú - Đắk Nông,Nguyên vật liệu,Khác,12000000
2149,DPHC,CTCP Đại Phú Hòa,,Khác,0
2150,DPJC,CTCP Đầu tư Xây Dựng Đại Thịnh Phát,,Khác,0
2151,DPLC,Công ty TNHH Điền Phát Land,,Khác,0
2152,DPQC,CTCP Đầu tư và Phát triển Du lịch Phú Quốc,,Khác,0
2153,DPWC,CTCP Đầu Tư Ngành nước DNP,,Khác,0
2154,DRGC,CTCP Đầu Tư và Du lịch Vạn Hương,,Khác,0
2155,DSS,CTCP Đường sắt Sài Gòn,Vận tải,OTC,2045000
2156,DSV,CTCP Đường sắt Vĩnh Phú,Vận tải,OTC,1229579
2157,DSVN,Tổng Công ty Đường sắt Việt Nam,,Khác,0
2158,DT319,CTCP Đầu tư và Thương mại 319,,OTC,0
2159,DT4,CTCP Quản Lý Đường Sông Số 4,Phân phối và bán lẻ hàng lâu bền,OTC,1160000
