STT,Mã CK▲,Tên công ty,Ngành,Sàn,Khối lượng NY/ĐKGD
874,NGC,CTCP Chế biến Thủy sản xuất khẩu Ngô Quyền,"Thực phẩm, đồ uống và thuốc lá",UPCoM,2299854
875,NHA,Tổng Công ty Đầu tư Phát triển Nhà và Đô thị Nam Hà Nội,Tư liệu sản xuất,HOSE,44174520
876,NHC,CTCP Gạch ngói Nhị Hiệp,Nguyên vật liệu,HNX,3041542
877,NHH,CTCP Nhựa Hà Nội,Nguyên vật liệu,HOSE,72880000
878,NHP,CTCP Sản xuất Xuất nhập khẩu NHP,Nguyên vật liệu,UPCoM,27576490
879,NHT,CTCP Sản xuất và Thương mại Nam Hoa,Nguyên vật liệu,HOSE,24028169
880,NHV,CTCP Sức Khỏe Hồi Sinh Việt Nam,Dịch vụ chuyên biệt và thương mại,UPCoM,5480112
881,NJC,CTCP May Nam Định,Hàng tiêu dùng và trang trí,UPCoM,4750000
882,NKG,CTCP Thép Nam Kim,Nguyên vật liệu,HOSE,447570881
883,NLG,CTCP Đầu tư Nam Long,Phát triển và quản lý bất động sản,HOSE,385075304
884,NLS,CTCP Cấp thoát nước Lạng Sơn,Dịch vụ tiện ích,UPCoM,5009800
885,NNC,CTCP Đá Núi Nhỏ,Nguyên vật liệu,HOSE,21920000
886,NNT,CTCP Cấp nước Ninh Thuận,Dịch vụ tiện ích,UPCoM,9490841
887,NO1,CTCP Tập đoàn 911,Tư liệu sản xuất,HOSE,24000000
888,NOS,CTCP Vận tải biển và Thương mại Phương Đông,Vận tải,UPCoM,20056000
889,NQB,CTCP Cấp nước Quảng Bình,Dịch vụ tiện ích,UPCoM,17230204
890,NQN,CTCP Nước sạch Quảng Ninh,Dịch vụ tiện ích,UPCoM,50831593
891,NQT,CTCP Nước sạch Quảng Trị,Dịch vụ tiện ích,UPCoM,18233269
892,NRC,CTCP Tập Đoàn Danh Khôi,Phát triển và quản lý bất động sản,HNX,92597762
893,NS2,CTCP Nước sạch Số 2 Hà Nội,Dịch vụ tiện ích,UPCoM,56800000
894,NSC,CTCP Tập đoàn Giống cây trồng Việt Nam,"Thực phẩm, đồ uống và thuốc lá",HOSE,17586988
895,NSG,CTCP Nhựa Sài Gòn,Nguyên vật liệu,UPCoM,8639208
896,NSH,CTCP Tập Đoàn Nhôm Sông Hồng Shalumi,Nguyên vật liệu,HNX,20693437
897,NSL,CTCP Cấp nước Sơn La,Dịch vụ tiện ích,UPCoM,10000000
898,NSS,CTCP Nông Súc Sản Đồng Nai,"Thực phẩm, đồ uống và thuốc lá",UPCoM,10263942
899,NST,CTCP Ngân Sơn,"Thực phẩm, đồ uống và thuốc lá",HNX,11202003
900,NT2,CTCP Điện lực Dầu khí Nhơn Trạch 2,Dịch vụ tiện ích,HOSE,287876029
901,NTB,CTCP Đầu tư Xây dựng và Khai thác Công trình Giao thông 584,Tư liệu sản xuất,UPCoM,39779577
902,NTC,CTCP Khu Công nghiệp Nam Tân Uyên,Phát triển và quản lý bất động sản,UPCoM,23999980
903,NTF,CTCP Dược - Vật tư Y tế Nghệ An,"Dược phẩm, Công nghệ sinh học và Khoa học thường thức",UPCoM,6000000
904,NTH,CTCP Thủy điện Nước Trong,Dịch vụ tiện ích,HNX,10802053
905,NTL,CTCP Phát triển Đô thị Từ Liêm,Phát triển và quản lý bất động sản,HOSE,121979900
906,NTP,CTCP Nhựa Thiếu niên Tiền Phong,Nguyên vật liệu,HNX,142532284
907,NTT,CTCP Dệt - May Nha Trang,Hàng tiêu dùng và trang trí,UPCoM,23500000
908,NTW,CTCP Cấp nước Nhơn Trạch,Dịch vụ tiện ích,UPCoM,10000000
909,NUE,CTCP Môi trường Đô thị Nha Trang,Dịch vụ tiện ích,UPCoM,6000000
910,NVB,Ngân hàng TMCP Quốc Dân,Tổ chức tín dụng,HNX,1177984751
911,NVL,CTCP Tập đoàn Đầu tư Địa ốc No Va,Phát triển và quản lý bất động sản,HOSE,1950104538
912,NVP,CTCP Nước sạch Vĩnh Phúc,Dịch vụ tiện ích,UPCoM,10963000
913,NVT,CTCP Bất động sản Du lịch Ninh Vân Bay,Dịch vụ tiêu dùng,HOSE,90500000
914,NWT,CTCP Vận tải Newway,Vận tải,UPCoM,8500000
915,NXT,CTCP Sản xuất và Cung ứng Vật liệu Xây dựng Kon Tum,Nguyên vật liệu,UPCoM,6600000
916,OCB,Ngân hàng TMCP Phương Đông,Tổ chức tín dụng,HOSE,2465789152
917,OCH,CTCP One Capital Hospitality,"Thực phẩm, đồ uống và thuốc lá",HNX,200000000
918,ODE,CTCP Tập đoàn Truyền thông và Giải trí ODE,Truyền thông và giải trí,UPCoM,10000000
919,OGC,CTCP Tập đoàn Đại Dương,"Thực phẩm, đồ uống và thuốc lá",HOSE,300000000
920,OIL,Tổng Công ty Dầu Việt Nam - CTCP,Phân phối và bán lẻ hàng lâu bền,UPCoM,201425936
921,ONE,CTCP Công nghệ One,Dịch vụ viễn thông,HNX,7960310
922,ONW,CTCP Dịch vụ Một Thế Giới,Truyền thông và giải trí,UPCoM,2000000
923,OPC,CTCP Dược phẩm OPC,"Dược phẩm, Công nghệ sinh học và Khoa học thường thức",HOSE,64050892
924,ORS,CTCP Chứng khoán Tiên Phong,Dịch vụ tài chính,HOSE,335999743
925,PAC,CTCP Pin Ắc quy Miền Nam,Tư liệu sản xuất,HOSE,46471707
926,PAI,CTCP Công nghệ thông tin Viễn thông và Tự động hóa Dầu Khí,Phần mềm và dịch vụ,UPCoM,4235290
927,PAN,CTCP Tập đoàn PAN,"Thực phẩm, đồ uống và thuốc lá",HOSE,216294580
928,PAP,CTCP Dầu khí Đầu tư Khai thác Cảng Phước An,Vận tải,UPCoM,232000000
929,PAS,CTCP Quốc tế Phương Anh,Nguyên vật liệu,UPCoM,28049968
930,PAT,CTCP Phốt Pho Apatit Việt Nam,Nguyên vật liệu,UPCoM,25000000
931,PBC,CTCP Dược phẩm Trung Ương 1- Pharbaco,"Dược phẩm, Công nghệ sinh học và Khoa học thường thức",UPCoM,113299902
932,PBP,CTCP Bao bì Dầu khí Việt Nam,Nguyên vật liệu,HNX,4799516
933,PBT,CTCP Bao bì và Thương mại dầu khí Bình Sơn,Nguyên vật liệu,UPCoM,17522284
934,PC1,CTCP Tập Đoàn PC1,Tư liệu sản xuất,HOSE,357642121
935,PCC,CTCP Tập đoàn Xây lắp 1 - Petrolimex,Nguyên vật liệu,UPCoM,11500000
936,PCE,CTCP Phân bón và Hóa chất Dầu khí Miền Trung,Nguyên vật liệu,HNX,10000000
937,PCF,CTCP Cà phê PETEC,Phân phối và bán lẻ hàng lâu bền,UPCoM,3000000
938,PCG,CTCP Đầu tư Phát triển Gas Đô thị,Dịch vụ tiện ích,HNX,18870000
939,PCH,CTCP Nhựa Picomat,Nguyên vật liệu,HNX,24199964
940,PCM,CTCP Vật liệu Xây dựng Bưu điện,Nguyên vật liệu,UPCoM,4000000
941,PCT,CTCP Vận tải biển Global Pacific,Vận tải,HNX,50035493
942,PDB,CTCP Tập đoàn Đầu tư Din Capital,Nguyên vật liệu,HNX,8909981
943,PDC,CTCP Du lịch Dầu khí Phương Đông,Dịch vụ tiêu dùng,UPCoM,15000000
944,PDN,CTCP Cảng Đồng Nai,Vận tải,HOSE,37043908
945,PDR,CTCP Phát triển Bất động sản Phát Đạt,Phát triển và quản lý bất động sản,HOSE,873140083
946,PDV,CTCP Vận Tải Và Tiếp Vận Phương Đông Việt,Vận tải,UPCoM,66095966
947,PEC,CTCP Cơ khí Điện lực,Nguyên vật liệu,UPCoM,3115409
948,PEG,Tổng Công ty Thương mại Kỹ thuật và Đầu tư - CTCP,Phân phối và bán lẻ hàng lâu bền,UPCoM,231898919
949,PEN,CTCP Xây lắp III Petrolimex,Tư liệu sản xuất,HNX,5000000
950,PEQ,CTCP Thiết bị Xăng dầu Petrolimex,Phân phối và bán lẻ hàng lâu bền,UPCoM,4965514
951,PET,Tổng Công ty cổ phần Dịch vụ Tổng hợp Dầu khí,Phân phối và bán lẻ hàng lâu bền,HOSE,107334831
952,PFL,CTCP Dầu khí Đông Đô,Tư liệu sản xuất,UPCoM,50000000
953,PGB,Ngân hàng TMCP Thịnh vượng và Phát triển,Tổ chức tín dụng,UPCoM,420000000
954,PGC,Tổng Công ty Gas Petrolimex - CTCP,Dịch vụ tiện ích,HOSE,60342638
955,PGD,CTCP Phân phối khí thấp áp Dầu khí Việt Nam,Dịch vụ tiện ích,HOSE,98998266
956,PGI,Tổng Công ty cổ phần Bảo hiểm Petrolimex,Bảo hiểm,HOSE,110896796
957,PGN,CTCP Phụ Gia Nhựa,Nguyên vật liệu,HNX,9464859
958,PGS,CTCP Kinh doanh Khí Miền Nam,Dịch vụ tiện ích,HNX,50000000
959,PGT,CTCP PGT Holdings,Dịch vụ chuyên biệt và thương mại,HNX,9241801
960,PGV,Tổng Công ty Phát điện 3 - CTCP,Dịch vụ tiện ích,HOSE,1123468046
961,PHC,CTCP Xây dựng Phục Hưng Holdings,Tư liệu sản xuất,HOSE,50602094
962,PHH,CTCP Hồng Hà Việt Nam,Phát triển và quản lý bất động sản,UPCoM,20000000
963,PHN,CTCP Pin Hà Nội,Tư liệu sản xuất,HNX,7253911
964,PHP,CTCP Cảng Hải Phòng,Vận tải,UPCoM,326960000
965,PHR,CTCP Cao su Phước Hòa,Nguyên vật liệu,HOSE,135499198
966,PHS,CTCP Chứng khoán Phú Hưng,Dịch vụ tài chính,UPCoM,200009819
967,PIA,CTCP Tin học Viễn thông Petrolimex,Phần mềm và dịch vụ,HNX,3900000
968,PIC,CTCP Đầu tư Điện lực 3,Dịch vụ tiện ích,HNX,33339891
969,PID,CTCP Trang Trí Nội Thất Dầu khí,Dịch vụ chuyên biệt và thương mại,UPCoM,4000000
970,PIS,Tổng Công ty Pisico Bình Định - CTCP,Nguyên vật liệu,UPCoM,27500000
971,PIT,CTCP Xuất nhập khẩu Petrolimex,Bán lẻ thực phẩm và nhu yếu phẩm,HOSE,15199345
972,PIV,CTCP PIV,Phân phối và bán lẻ hàng lâu bền,UPCoM,17324942
973,PJC,CTCP Thương mại và Vận tải Petrolimex Hà Nội,Phân phối và bán lẻ hàng lâu bền,HNX,7326928
974,PJS,CTCP Cấp nước Phú Hòa Tân,Dịch vụ tiện ích,UPCoM,9000000
975,PJT,CTCP Vận tải Xăng dầu đường Thủy Petrolimex,Năng lượng,HOSE,24882785
976,PLA,CTCP Đầu tư và Dịch vụ Hạ tầng Xăng dầu,Phát triển và quản lý bất động sản,UPCoM,10000000
977,PLC,Tổng Công ty Hóa dầu Petrolimex - CTCP,Nguyên vật liệu,HNX,80798839
978,PLE,CTCP Tư vấn Xây dựng Petrolimex,Dịch vụ chuyên biệt và thương mại,UPCoM,1215000
979,PLO,CTCP Kho Vận Petec,Phân phối và bán lẻ hàng lâu bền,UPCoM,7192550
980,PLP,CTCP Sản xuất và Công nghệ Nhựa Pha Lê,Nguyên vật liệu,HOSE,70000000
981,PLX,Tập đoàn Xăng Dầu Việt Nam,Phân phối và bán lẻ hàng lâu bền,HOSE,1293878081
982,PMB,CTCP Phân bón và Hóa chất Dầu khí Miền Bắc,Nguyên vật liệu,HNX,12000000
983,PMC,CTCP Dược phẩm Dược liệu Pharmedic,"Dược phẩm, Công nghệ sinh học và Khoa học thường thức",HNX,9332573
984,PMG,CTCP Đầu tư và Sản xuất Petro Miền Trung,Dịch vụ tiện ích,HOSE,46336278
985,PMJ,CTCP Vật tư Bưu Điện,Phân phối và bán lẻ hàng lâu bền,UPCoM,1800000
986,PMP,CTCP Bao bì đạm Phú Mỹ,Nguyên vật liệu,HNX,4200000
987,PMS,CTCP Cơ khí Xăng dầu,Phân phối và bán lẻ hàng lâu bền,HNX,7227662
988,PMT,CTCP Viễn thông TELVINA Việt Nam,Dịch vụ viễn thông,UPCoM,5000000
989,PMW,CTCP Cấp nước Phú Mỹ,Dịch vụ tiện ích,UPCoM,49999832
990,PNC,CTCP Văn hóa Phương Nam,Phân phối và bán lẻ hàng lâu bền,HOSE,11040241
991,PND,CTCP Xăng dầu Dầu khí Nam Định,Phân phối và bán lẻ hàng lâu bền,UPCoM,6666666
992,PNG,CTCP Thương mại Phú Nhuận,Dịch vụ tiêu dùng,UPCoM,9000000
993,PNJ,CTCP Vàng bạc Đá quý Phú Nhuận,Phân phối và bán lẻ hàng lâu bền,HOSE,338074776
994,PNP,CTCP Tân Cảng - Phú Hữu,Vận tải,UPCoM,16100000
995,PNT,CTCP Kỹ thuật Xây dựng Phú Nhuận,Phát triển và quản lý bất động sản,UPCoM,9282802
996,POB,CTCP Xăng dầu Dầu khí Thái Bình,Phân phối và bán lẻ hàng lâu bền,UPCoM,10900000
997,POM,CTCP Thép Pomina,Nguyên vật liệu,UPCoM,279676336
998,POS,"CTCP Dịch vụ Lắp đặt, Vận hành và Bảo dưỡng Công trình Dầu khí Biển PTSC",Năng lượng,UPCoM,40000000
999,POT,CTCP Thiết bị Bưu điện,Công nghệ phần cứng và thiết bị,HNX,19430006
1000,POV,CTCP Xăng dầu Dầu khí Vũng Áng,Phân phối và bán lẻ hàng lâu bền,UPCoM,12499612
1001,POW,Tổng Công ty Điện lực Dầu khí Việt Nam - CTCP,Dịch vụ tiện ích,HOSE,2341871600
1002,PPC,CTCP Nhiệt điện Phả Lại,Dịch vụ tiện ích,HOSE,326235000
1003,PPE,CTCP Tư vấn đầu tư PP Enterprise,Dịch vụ chuyên biệt và thương mại,HNX,2000000
1004,PPH,Tổng Công ty cổ phần Phong Phú,Hàng tiêu dùng và trang trí,UPCoM,74670891
1005,PPI,CTCP Đầu tư và Phát triển Dự án Hạ tầng Thái Bình Dương,Phát triển và quản lý bất động sản,UPCoM,48290629
1006,PPP,CTCP Dược phẩm Phong Phú,"Dược phẩm, Công nghệ sinh học và Khoa học thường thức",HNX,8799991
1007,PPS,CTCP Dịch vụ Kỹ thuật Điện lực Dầu khí Việt Nam,Tư liệu sản xuất,HNX,15000000
1008,PPT,CTCP Petro Times,Phân phối và bán lẻ hàng lâu bền,HNX,18189988
1009,PPY,CTCP Xăng dầu Dầu khí Phú Yên,Phân phối và bán lẻ hàng lâu bền,HNX,9343974
1010,PQN,CTCP Dịch vụ Dầu khí Quảng Ngãi PTSC,Tư liệu sản xuất,UPCoM,30000000
1011,PRC,CTCP Logistics Portserco,Vận tải,HNX,1200000
1012,PRE,Tổng Công ty cổ phần Tái bảo hiểm Hà Nội,Bảo hiểm,HNX,104400000
1013,PRO,CTCP Procimex Việt Nam,"Thực phẩm, đồ uống và thuốc lá",UPCoM,3000000
1014,PRT,Tổng Công ty Sản xuất - Xuất nhập khẩu Bình Dương - CTCP,Nguyên vật liệu,UPCoM,300000000
1015,PSB,CTCP Đầu tư Dầu khí Sao Mai - Bến Đình,Năng lượng,UPCoM,50000000
1016,PSC,CTCP Vận tải và Dịch vụ Petrolimex Sài Gòn,Phân phối và bán lẻ hàng lâu bền,HNX,7200000
1017,PSD,CTCP Dịch vụ Phân phối Tổng hợp Dầu khí,Phân phối và bán lẻ hàng lâu bền,HNX,51827894
1018,PSE,CTCP Phân Bón và Hóa Chất Dầu khí Đông Nam Bộ,Nguyên vật liệu,HNX,12500000
1019,PSG,CTCP Đầu Tư và Xây lắp Dầu khí Sài Gòn,Phát triển và quản lý bất động sản,UPCoM,35000000
1020,PSH,CTCP Thương mại Đầu tư Dầu khí Nam Sông Hậu,Phân phối và bán lẻ hàng lâu bền,HOSE,126196780
1021,PSI,CTCP Chứng khoán Dầu khí,Dịch vụ tài chính,HNX,59841300
1022,PSL,CTCP Chăn nuôi Phú Sơn,"Thực phẩm, đồ uống và thuốc lá",UPCoM,11812500
1023,PSN,CTCP Dịch Vụ Kỹ Thuật PTSC Thanh Hóa,Vận tải,UPCoM,40000000
1024,PSP,CTCP Cảng Dịch vụ Dầu khí Đình Vũ,Vận tải,UPCoM,40000000
1025,PSW,CTCP Phân bón và Hóa chất Dầu khí Tây Nam Bộ,Nguyên vật liệu,HNX,17000000
1026,PTB,CTCP Phú Tài,Nguyên vật liệu,HOSE,66938403
1027,PTC,CTCP Đầu Tư Icapital,Dịch vụ tiện ích,HOSE,32307324
1028,PTD,CTCP Thiết kế Xây dựng Thương mại Phúc Thịnh,Tư liệu sản xuất,HNX,4999933
1029,PTE,CTCP Xi măng Phú Thọ,Nguyên vật liệu,UPCoM,12500000
1030,PTG,CTCP May Xuất khẩu Phan Thiết,Hàng tiêu dùng và trang trí,UPCoM,4996185
1031,PTH,CTCP Vận tải và Dịch vụ Petrolimex Hà Tây,Phân phối và bán lẻ hàng lâu bền,UPCoM,3503164
1032,PTI,Tổng Công ty cổ phần Bảo hiểm Bưu điện,Bảo hiểm,HNX,120592129
1033,PTL,CTCP Victory Group,Phát triển và quản lý bất động sản,HOSE,100000000
1034,PTO,CTCP Dịch vụ - Xây dựng Công trình Bưu Điện,Tư liệu sản xuất,UPCoM,1200000
1035,PTP,CTCP PTP,Dịch vụ viễn thông,UPCoM,6800000
1036,PTS,CTCP Vận tải và Dịch vụ Petrolimex Hải Phòng,Vận tải,HNX,5568000
1037,PTT,CTCP Vận tải Dầu khí Đông Dương,Vận tải,UPCoM,16493172
1038,PTV,CTCP Thương mại Dầu khí,Phân phối và bán lẻ hàng lâu bền,UPCoM,20000000
1039,PTX,CTCP Vận tải và Dịch vụ Petrolimex Nghệ Tĩnh,Năng lượng,HNX,6432453
1040,PV2,CTCP Đầu tư PV2,Dịch vụ tài chính,HNX,37350000
1041,PVA,CTCP Tổng Công ty Xây lắp Dầu khí Nghệ An,Tư liệu sản xuất,UPCoM,21846000
1042,PVB,CTCP Bọc ống Dầu khí Việt Nam,Năng lượng,HNX,21599998
1043,PVC,Tổng Công ty Hóa chất và Dịch vụ Dầu khí - CTCP,Năng lượng,HNX,81194463
1044,PVD,Tổng Công ty cổ phần Khoan và Dịch vụ khoan Dầu khí,Năng lượng,HOSE,556296006
1045,PVE,Tổng Công ty Tư vấn thiết kế Dầu khí - CTCP,Tư liệu sản xuất,UPCoM,25000000
1046,PVG,CTCP Kinh doanh LPG Việt Nam,Dịch vụ tiện ích,HNX,39998522
1047,PVH,CTCP Xây lắp Dầu khí Thanh Hóa,Tư liệu sản xuất,UPCoM,21000000
1048,PVI,CTCP PVI,Bảo hiểm,HNX,234241867
1049,PVL,CTCP Đầu tư Nhà Đất Việt,Phát triển và quản lý bất động sản,UPCoM,50000000
1050,PVM,CTCP Máy - Thiết bị Dầu khí,Tư liệu sản xuất,UPCoM,38638600
1051,PVO,CTCP Dầu nhờn PV Oil,Phân phối và bán lẻ hàng lâu bền,UPCoM,8900000
1052,PVP,CTCP Vận tải Dầu khí Thái Bình Dương,Năng lượng,HOSE,103702452
1053,PVR,CTCP Đầu tư PVR Hà Nội,Phát triển và quản lý bất động sản,UPCoM,53100913
1054,PVS,Tổng Công ty cổ phần Dịch vụ Kỹ thuật Dầu khí Việt Nam,Năng lượng,HNX,477966290
1055,PVT,Tổng Công ty cổ phần Vận tải Dầu khí,Năng lượng,HOSE,356012638
1056,PVV,CTCP Vinaconex 39,Tư liệu sản xuất,UPCoM,30000000
1057,PVX,Tổng Công ty cổ phần Xây lắp Dầu khí Việt Nam,Tư liệu sản xuất,UPCoM,400000000
1058,PVY,CTCP Chế tạo Giàn khoan Dầu khí,Tư liệu sản xuất,UPCoM,59489787
1059,PWA,CTCP Bất động sản Dầu khí,Phát triển và quản lý bất động sản,UPCoM,10000000
1060,PWS,CTCP Cấp thoát nước Phú Yên,Dịch vụ tiện ích,UPCoM,38363579
1061,PX1,CTCP Xi măng Sông Lam 2,Nguyên vật liệu,UPCoM,20000000
1062,PXA,CTCP Đầu tư và Thương mại Dầu khí Nghệ An,Phát triển và quản lý bất động sản,UPCoM,15000000
1063,PXC,CTCP Phát triển Đô thị Dầu khí,Tư liệu sản xuất,UPCoM,28068900
1064,PXI,CTCP Xây dựng Công nghiệp và Dân dụng Dầu khí,Tư liệu sản xuất,UPCoM,30000000
1065,PXL,CTCP Đầu tư Khu Công nghiệp Dầu khí Long Sơn,Phát triển và quản lý bất động sản,UPCoM,176145500
1066,PXM,CTCP Xây lắp Dầu khí Miền Trung,Phân phối và bán lẻ hàng lâu bền,UPCoM,15000000
1067,PXS,CTCP Kết cấu Kim loại và Lắp máy Dầu khí,Tư liệu sản xuất,UPCoM,60000000
1068,PXT,CTCP Xây lắp Đường ống Bể chứa Dầu khí,Tư liệu sản xuất,UPCoM,20000000
1069,QBS,CTCP Xuất nhập khẩu Quảng Bình,Nguyên vật liệu,UPCoM,69329928
1070,QCC,CTCP Đầu tư Xây dựng và Phát triển Hạ tầng Viễn thông,Tư liệu sản xuất,UPCoM,1500000
1071,QCG,CTCP Quốc Cường Gia Lai,Phát triển và quản lý bất động sản,HOSE,275129310
1072,QHD,CTCP Que hàn điện Việt Đức,Tư liệu sản xuất,HNX,5524716
1073,QHW,CTCP Nước khoáng Quảng Ninh,"Thực phẩm, đồ uống và thuốc lá",UPCoM,8000000
1074,QNC,CTCP Xi măng và Xây dựng Quảng Ninh,Nguyên vật liệu,UPCoM,60000000
1075,QNP,CTCP Cảng Quy Nhơn,Vận tải,HOSE,40409950
1076,QNS,CTCP Đường Quảng Ngãi,"Thực phẩm, đồ uống và thuốc lá",UPCoM,367648153
1077,QNT,CTCP Tư vấn Phát triển Quảng Nam,Dịch vụ chuyên biệt và thương mại,UPCoM,3222000
1078,QNU,CTCP Môi trường Đô thị Quảng Nam,Dịch vụ tiện ích,UPCoM,6800000
1079,QNW,CTCP Cấp thoát nước và Xây dựng Quảng Ngãi,Dịch vụ tiện ích,UPCoM,20000000
1080,QPH,CTCP Thủy điện Quế Phong,Dịch vụ tiện ích,UPCoM,18583100
1081,QSP,CTCP Tân Cảng Quy Nhơn,Vận tải,UPCoM,10792275
1082,QST,CTCP Sách và Thiết bị Trường học Quảng Ninh,Truyền thông và giải trí,HNX,3240000
1083,QTC,CTCP Công trình Giao thông Vận tải Quảng Nam,Tư liệu sản xuất,HNX,2700000
1084,QTP,CTCP Nhiệt điện Quảng Ninh,Dịch vụ tiện ích,UPCoM,450000000
1085,RAL,CTCP Bóng đèn Phích nước Rạng Đông,Tư liệu sản xuất,HOSE,23547419
1086,RAT,CTCP Vận tải và Thương mại Đường sắt,Vận tải,UPCoM,5921841
1087,RBC,CTCP Công nghiệp và Xuất nhập khẩu Cao su,Xe và linh kiện,UPCoM,10030308
1088,RCC,CTCP Tổng Công ty Công trình Đường sắt,Tư liệu sản xuất,UPCoM,32064749
1089,RCD,CTCP Xây dựng - Địa ốc Cao su,Tư liệu sản xuất,UPCoM,5300062
1090,RCL,CTCP Địa ốc Chợ Lớn,Phát triển và quản lý bất động sản,HNX,13858714
1091,REE,CTCP Cơ Điện Lạnh,Dịch vụ tiện ích,HOSE,471013400
1092,RIC,CTCP Quốc tế Hoàng Gia,Dịch vụ tiêu dùng,UPCoM,28708169
1093,RTB,CTCP Cao su Tân Biên,Nguyên vật liệu,UPCoM,87945000
1094,RYG,CTCP Sản xuất và Đầu tư Hoàng Gia,Tư liệu sản xuất,HOSE,45000000
1095,S12,CTCP Sông Đà 12,Tư liệu sản xuất,UPCoM,5000000
1096,S27,CTCP Sông Đà 27,Nguyên vật liệu,UPCoM,1572833
1097,S4A,CTCP Thủy điện Sê San 4A,Dịch vụ tiện ích,HOSE,42200000
1098,S55,CTCP Sông Đà 505,Tư liệu sản xuất,HNX,10000000
1099,S72,CTCP Sông Đà 7.02,Dịch vụ tiện ích,UPCoM,12000000
1100,S74,CTCP Sông Đà 7.04,Nguyên vật liệu,UPCoM,6480000
1101,S96,CTCP Sông Đà 9.06,Tư liệu sản xuất,UPCoM,11155532
1102,S99,CTCP SCI,Tư liệu sản xuất,HNX,99134331
1103,SAB,Tổng Công ty cổ phần Bia - Rượu - Nước giải khát Sài Gòn,"Thực phẩm, đồ uống và thuốc lá",HOSE,1282562372
1104,SAC,CTCP Xếp dỡ và Dịch vụ Cảng Sài Gòn,Vận tải,UPCoM,4050000
1105,SAF,CTCP Lương thực Thực phẩm Safoco,"Thực phẩm, đồ uống và thuốc lá",HNX,12046590
1106,SAL,CTCP Trục vớt Cứu hộ Việt Nam,Vận tải,UPCoM,8310000
1107,SAM,CTCP SAM Holdings,Tư liệu sản xuất,HOSE,379960971
1108,SAP,CTCP In Sách giáo khoa Thành phố Hồ Chí Minh,Dịch vụ chuyên biệt và thương mại,UPCoM,1286984
1109,SAS,CTCP Dịch vụ Hàng không Sân bay Tân Sơn Nhất,Vận tải,UPCoM,133481310
1110,SAV,CTCP Hợp tác Kinh tế và Xuất nhập khẩu Savimex,Hàng tiêu dùng và trang trí,HOSE,25189965
1111,SB1,CTCP Bia Sài Gòn - Nghệ Tĩnh,"Thực phẩm, đồ uống và thuốc lá",UPCoM,10500000
1112,SBA,CTCP Sông Ba,Dịch vụ tiện ích,HOSE,60488261
1113,SBB,CTCP Tập đoàn Bia Sài Gòn - Bình Tây,"Thực phẩm, đồ uống và thuốc lá",UPCoM,87524536
1114,SBD,CTCP Công nghệ Sao Bắc Đẩu,Phần mềm và dịch vụ,UPCoM,13916480
1115,SBG,CTCP Tập đoàn Cơ khí Công nghệ cao Siba,Tư liệu sản xuất,HOSE,49999963
1116,SBH,CTCP Thủy điện Sông Ba Hạ,Dịch vụ tiện ích,UPCoM,124225000
1117,SBL,CTCP Bia Sài Gòn - Bạc Liêu,"Thực phẩm, đồ uống và thuốc lá",UPCoM,12012000
1118,SBM,CTCP Đầu tư Phát triển Bắc Minh,Dịch vụ tiện ích,UPCoM,45044953
1119,SBR,CTCP Cao su Sông Bé,Nguyên vật liệu,UPCoM,81396192
1120,SBS,CTCP Chứng khoán SBS,Dịch vụ tài chính,UPCoM,146607600
1121,SBT,CTCP Thành Thành Công - Biên Hòa,"Thực phẩm, đồ uống và thuốc lá",HOSE,814545038
1122,SBV,CTCP Siam Brothers Việt Nam,Hàng tiêu dùng và trang trí,HOSE,27366476
1123,SC5,CTCP Xây dựng Số 5,Tư liệu sản xuất,HOSE,14984550
1124,SCC,CTCP Thương mại Đầu tư SHB,Nguyên vật liệu,UPCoM,4884900
1125,SCD,CTCP Nước giải khát Chương Dương,"Thực phẩm, đồ uống và thuốc lá",UPCoM,8500000
1126,SCG,CTCP Tập đoàn Xây dựng SCG,Tư liệu sản xuất,HNX,85000000
1127,SCI,CTCP SCI E&C,Tư liệu sản xuất,HNX,30491409
1128,SCJ,CTCP Xi măng Sài Sơn,Nguyên vật liệu,UPCoM,57839000
1129,SCL,CTCP Sông Đà Cao Cường,Nguyên vật liệu,UPCoM,18660895
1130,SCO,CTCP Công nghiệp Thủy sản,Vận tải,UPCoM,4200000
1131,SCR,CTCP Địa ốc Sài Gòn Thương Tín,Phát triển và quản lý bất động sản,HOSE,430595036
1132,SCS,CTCP Dịch vụ Hàng hóa Sài Gòn,Vận tải,HOSE,94886982
1133,SCY,CTCP Đóng tàu Sông Cấm,Tư liệu sản xuất,UPCoM,61968926
1134,SD1,CTCP Sông Đà 1,Tư liệu sản xuất,UPCoM,5000000
1135,SD2,CTCP Sông Đà 2,Tư liệu sản xuất,UPCoM,14423536
1136,SD3,CTCP Sông Đà 3,Dịch vụ tiện ích,UPCoM,15999356
1137,SD4,CTCP Sông Đà 4,Tư liệu sản xuất,UPCoM,10300000
1138,SD5,CTCP Sông Đà 5,Tư liệu sản xuất,HNX,25999848
1139,SD6,CTCP Sông Đà 6,Tư liệu sản xuất,UPCoM,34771611
1140,SD7,CTCP Sông Đà 7,Tư liệu sản xuất,UPCoM,10600000
1141,SD8,CTCP Sông Đà 8,Tư liệu sản xuất,UPCoM,2800000
1142,SD9,CTCP Sông Đà 9,Dịch vụ tiện ích,HNX,34234000
1143,SDA,CTCP Simco Sông Đà,Dịch vụ chuyên biệt và thương mại,HNX,26206158
1144,SDB,CTCP Sông Đà 207,Tư liệu sản xuất,UPCoM,11000000
1145,SDC,CTCP Tư vấn Sông Đà,Dịch vụ chuyên biệt và thương mại,HNX,2609710
1146,SDD,CTCP Đầu tư và Xây lắp Sông Đà,Tư liệu sản xuất,UPCoM,16007685
1147,SDG,CTCP Sadico Cần Thơ,Nguyên vật liệu,HNX,10139997
1148,SDJ,CTCP Sông Đà 25,Nguyên vật liệu,UPCoM,4343700
1149,SDK,CTCP Cơ khí Luyện kim,Nguyên vật liệu,UPCoM,2600000
1150,SDN,CTCP Sơn Đồng Nai,Nguyên vật liệu,HNX,3036436
1151,SDP,CTCP SDP,Tư liệu sản xuất,UPCoM,11114472
1152,SDT,CTCP Sông Đà 10,Tư liệu sản xuất,UPCoM,42732311
1153,SDU,CTCP Đầu tư Xây dựng và Phát triển Đô thị Sông Đà,Phát triển và quản lý bất động sản,HNX,20000000
1154,SDV,CTCP Dịch vụ Sonadezi,Dịch vụ chuyên biệt và thương mại,UPCoM,5000000
1155,SDX,CTCP Phòng cháy Chữa cháy và Đầu tư Xây dựng Sông Đà,Tư liệu sản xuất,UPCoM,2250000
1156,SDY,CTCP Xi măng Sông Đà Yaly,Nguyên vật liệu,UPCoM,4500000
1157,SEA,Tổng Công ty Thủy sản Việt Nam - CTCP,"Thực phẩm, đồ uống và thuốc lá",UPCoM,125000000
1158,SEB,CTCP Đầu tư và Phát triển Điện Miền Trung,Dịch vụ tiện ích,HNX,31999969
1159,SED,CTCP Đầu tư và Phát triển Giáo dục Phương Nam,Truyền thông và giải trí,HNX,10000000
1160,SEP,CTCP Tổng Công ty Thương mại Quảng Trị,"Thực phẩm, đồ uống và thuốc lá",UPCoM,8400000
